[{
	"index": 0,
	"title": "Menn",
	"id": 1090,
	"parentId": "1",
	"dateAddedLocal": "1/22/2023, 9:44:12 AM",
	"dateAddedUTC": "2023-01-22T15:44:12.670Z"
},{
	"index": 0,
	"title": "on-call-schedule.pdf",
	"url": "http://thelink/Assets/on-call-schedule.pdf",
	"id": 1096,
	"parentId": "1090",
	"dateAddedLocal": "10/15/2022, 5:14:25 PM",
	"dateAddedUTC": "2022-10-15T22:14:25.670Z"
},{
	"index": 1,
	"title": "Resources",
	"id": 1092,
	"parentId": "1090",
	"dateAddedLocal": "10/15/2022, 12:08:04 PM",
	"dateAddedUTC": "2022-10-15T17:08:04.421Z"
},{
	"index": 0,
	"title": "My Courses | AHA eLearning",
	"url": "https://elearning.heart.org/mycourse",
	"id": 1093,
	"parentId": "1092",
	"dateAddedLocal": "10/15/2022, 12:08:27 PM",
	"dateAddedUTC": "2022-10-15T17:08:27.878Z"
},{
	"index": 1,
	"title": "Course Detail | Psych Hub",
	"url": "https://app.psychhub.com/course/catalog",
	"id": 1094,
	"parentId": "1092",
	"dateAddedLocal": "10/21/2022, 6:24:26 PM",
	"dateAddedUTC": "2022-10-21T23:24:26.495Z"
},{
	"index": 2,
	"title": "Food Menu",
	"url": "http://thelink/Assets/cafeteriamenu.docx",
	"id": 1095,
	"parentId": "1090",
	"dateAddedLocal": "1/22/2023, 9:42:16 AM",
	"dateAddedUTC": "2023-01-22T15:42:16.505Z"
},{
	"index": 3,
	"title": "People",
	"url": "https://outlook.office.com/people/",
	"id": 1088,
	"parentId": "1090",
	"dateAddedLocal": "3/18/2023, 7:46:17 AM",
	"dateAddedUTC": "2023-03-18T12:46:17.870Z"
},{
	"index": 4,
	"title": "Charting",
	"url": "https://nursing-tool.bubbleapps.io/version-test/sa",
	"id": 1098,
	"parentId": "1090",
	"dateAddedLocal": "5/9/2022, 12:54:23 PM",
	"dateAddedUTC": "2022-05-09T17:54:23.200Z"
},{
	"index": 5,
	"title": "The Link",
	"url": "http://thelink/",
	"id": 1122,
	"parentId": "1090",
	"dateAddedLocal": "2/20/2024, 7:53:43 AM",
	"dateAddedUTC": "2024-02-20T13:53:43.562Z"
},{
	"index": 6,
	"title": "ScheduleAnywhere",
	"url": "https://scheduleanywhere.tcpsoftware.com/wp-login.php",
	"id": 1124,
	"parentId": "1090",
	"dateAddedLocal": "2/20/2024, 7:53:53 AM",
	"dateAddedUTC": "2024-02-20T13:53:53.691Z"
},{
	"index": 7,
	"title": "ADP",
	"url": "https://online.adp.com/signin/v1/?APPID=WFNPortal&productId=80e309c3-7085-bae1-e053-3505430b5495&returnURL=https://workforcenow.adp.com/&callingAppId=WFN",
	"id": 1121,
	"parentId": "1090",
	"dateAddedLocal": "2/20/2024, 7:53:59 AM",
	"dateAddedUTC": "2024-02-20T13:53:59.673Z"
},{
	"index": 8,
	"title": "Incident Report RL6",
	"url": "http://incidents.menninger.edu/",
	"id": 1123,
	"parentId": "1090",
	"dateAddedLocal": "2/20/2024, 7:54:03 AM",
	"dateAddedUTC": "2024-02-20T13:54:03.137Z"
},{
	"index": 9,
	"title": "Quest",
	"url": "https://auth2.questdiagnostics.com/cas/login?service=https%3A%2F%2Fphysician.quanum.questdiagnostics.com%2Fhcp-server-web%2Flogin%2Fcas",
	"id": 1120,
	"parentId": "1090",
	"dateAddedLocal": "2/20/2024, 7:54:07 AM",
	"dateAddedUTC": "2024-02-20T13:54:07.994Z"
},{
	"index": 10,
	"title": "LexiComp",
	"url": "https://online.lexi.com/lco/action/home/",
	"id": 1118,
	"parentId": "1090",
	"dateAddedLocal": "2/20/2024, 7:54:12 AM",
	"dateAddedUTC": "2024-02-20T13:54:12.345Z"
},{
	"index": 11,
	"title": "UpToDate",
	"url": "https://www.uptodate.com/contents/search",
	"id": 1119,
	"parentId": "1090",
	"dateAddedLocal": "2/20/2024, 7:54:15 AM",
	"dateAddedUTC": "2024-02-20T13:54:15.753Z"
},{
	"index": 12,
	"title": "Contact List",
	"url": "https://call.built.at/",
	"id": 1132,
	"parentId": "1090",
	"dateAddedLocal": "3/7/2024, 3:16:51 PM",
	"dateAddedUTC": "2024-03-07T21:16:51.891Z"
},{
	"index": 13,
	"title": "Call",
	"url": "https://linksaw.com/call/",
	"id": 1156,
	"parentId": "1090",
	"dateAddedLocal": "9/12/2024, 1:02:39 PM",
	"dateAddedUTC": "2024-09-12T18:02:39.048Z"
},{
	"index": 14,
	"title": "Teams",
	"url": "https://teams.microsoft.com/v2/",
	"id": 1169,
	"parentId": "1090",
	"dateAddedLocal": "12/10/2024, 3:28:31 PM",
	"dateAddedUTC": "2024-12-10T21:28:31.787Z"
},{
	"index": 1,
	"title": "",
	"url": "https://outlook.office365.com/",
	"id": 1099,
	"parentId": "1",
	"dateAddedLocal": "4/25/2022, 11:24:24 AM",
	"dateAddedUTC": "2022-04-25T16:24:24.601Z"
},{
	"index": 2,
	"title": "",
	"url": "https://mail.google.com/mail/u/0/#inbox",
	"id": 498,
	"parentId": "1",
	"dateAddedLocal": "3/15/2019, 6:32:54 PM",
	"dateAddedUTC": "2019-03-15T23:32:54.212Z"
},{
	"index": 3,
	"title": "",
	"url": "http://sa.wyr.es/",
	"id": 1109,
	"parentId": "1",
	"dateAddedLocal": "5/9/2022, 12:54:23 PM",
	"dateAddedUTC": "2022-05-09T17:54:23.200Z"
},{
	"index": 4,
	"title": "",
	"url": "https://cernltca.cernerworks.com/Citrix/PRODweb/",
	"id": 1125,
	"parentId": "1",
	"dateAddedLocal": "2/20/2024, 7:54:21 AM",
	"dateAddedUTC": "2024-02-20T13:54:21.848Z"
},{
	"index": 5,
	"title": "More",
	"id": 1146,
	"parentId": "1",
	"dateAddedLocal": "5/13/2024, 10:23:21 AM",
	"dateAddedUTC": "2024-05-13T15:23:21.335Z"
},{
	"index": 0,
	"title": "Raindrop",
	"url": "https://app.raindrop.io/my/42287170",
	"id": 1076,
	"parentId": "1146",
	"dateAddedLocal": "9/18/2023, 2:57:25 PM",
	"dateAddedUTC": "2023-09-18T19:57:25.022Z"
},{
	"index": 1,
	"title": "",
	"url": "https://get.pinned.at/",
	"id": 1130,
	"parentId": "1146",
	"dateAddedLocal": "3/4/2024, 9:43:10 PM",
	"dateAddedUTC": "2024-03-05T03:43:10.715Z"
},{
	"index": 2,
	"title": "To do",
	"url": "https://keep.google.com/u/0/#LIST/1rYm6rc8L_6A3PPI9WMh7VNU6PU5GbIezNbpZvSVRsKnkaWZZZs41K406YDrihQnCdnMPEszn",
	"id": 1141,
	"parentId": "1146",
	"dateAddedLocal": "3/19/2024, 11:57:01 AM",
	"dateAddedUTC": "2024-03-19T16:57:01.892Z"
},{
	"index": 3,
	"title": "NTS",
	"url": "https://mail.google.com/mail/u/0/?to=natepuls@gmail.com&fs=1&tf=cm",
	"id": 1139,
	"parentId": "1146",
	"dateAddedLocal": "3/18/2024, 9:11:22 AM",
	"dateAddedUTC": "2024-03-18T14:11:22.048Z"
},{
	"index": 4,
	"title": "+",
	"url": "https://codepen.io/pen",
	"id": 1137,
	"parentId": "1146",
	"dateAddedLocal": "3/12/2024, 9:34:26 AM",
	"dateAddedUTC": "2024-03-12T14:34:26.929Z"
},{
	"index": 5,
	"title": "Built.at",
	"url": "https://built.at/",
	"id": 1136,
	"parentId": "1146",
	"dateAddedLocal": "3/12/2024, 9:32:03 AM",
	"dateAddedUTC": "2024-03-12T14:32:03.152Z"
},{
	"index": 6,
	"title": "map",
	"url": "https://built.at/x/numlink/",
	"id": 1134,
	"parentId": "1146",
	"dateAddedLocal": "3/9/2024, 2:58:15 PM",
	"dateAddedUTC": "2024-03-09T20:58:15.986Z"
},{
	"index": 7,
	"title": "Fun",
	"id": 1101,
	"parentId": "1146",
	"dateAddedLocal": "1/25/2024, 3:29:35 PM",
	"dateAddedUTC": "2024-01-25T21:29:35.618Z"
},{
	"index": 0,
	"title": "+",
	"id": 766,
	"parentId": "1101",
	"dateAddedLocal": "10/8/2020, 1:47:45 PM",
	"dateAddedUTC": "2020-10-08T18:47:45.100Z"
},{
	"index": 0,
	"title": "ðŸ”¨wyr.es edit",
	"id": 767,
	"parentId": "766",
	"dateAddedLocal": "10/8/2020, 1:47:45 PM",
	"dateAddedUTC": "2020-10-08T18:47:45.102Z"
},{
	"index": 0,
	"title": "home edit",
	"url": "http://wyr.es/wp-admin/post.php?post=123&action=edit#layout-options-tab",
	"id": 693,
	"parentId": "767",
	"dateAddedLocal": "12/17/2019, 12:34:33 PM",
	"dateAddedUTC": "2019-12-17T18:34:33.144Z"
},{
	"index": 1,
	"title": "WP Coder version 2.4 â€¹ wyr.es â€” WordPress",
	"url": "http://wyr.es/wp-admin/admin.php?page=wp-coder",
	"id": 691,
	"parentId": "767",
	"dateAddedLocal": "12/17/2019, 12:38:13 PM",
	"dateAddedUTC": "2019-12-17T18:38:13.626Z"
},{
	"index": 2,
	"title": "home2 â€“ wyr.es",
	"url": "http://wyr.es/home-test/",
	"id": 697,
	"parentId": "767",
	"dateAddedLocal": "12/17/2019, 1:05:42 PM",
	"dateAddedUTC": "2019-12-17T19:05:42.345Z"
},{
	"index": 3,
	"title": "404 Edit Page â€¹ wyr.es â€” WordPress",
	"url": "http://wyr.es/wp-admin/post.php?post=337&action=edit#layout-options-tab",
	"id": 692,
	"parentId": "767",
	"dateAddedLocal": "12/17/2019, 4:20:21 PM",
	"dateAddedUTC": "2019-12-17T22:20:21.960Z"
},{
	"index": 4,
	"title": "WP Htaccess Editor â€¹ wyr.es â€” WordPress",
	"url": "http://wyr.es/wp-admin/options-general.php?page=wp-htaccess-editor",
	"id": 689,
	"parentId": "767",
	"dateAddedLocal": "12/18/2019, 6:26:20 PM",
	"dateAddedUTC": "2019-12-19T00:26:20.591Z"
},{
	"index": 5,
	"title": "mod rewrite - Removing special characters from query string in .htaccess - Stack Overflow",
	"url": "https://stackoverflow.com/questions/26426411/removing-special-characters-from-query-string-in-htaccess?noredirect=1&lq=1",
	"id": 696,
	"parentId": "767",
	"dateAddedLocal": "12/18/2019, 6:47:04 PM",
	"dateAddedUTC": "2019-12-19T00:47:04.186Z"
},{
	"index": 6,
	"title": ".htaccess - 301 Redirect to replace all spaces to hyphens - Stack Overflow",
	"url": "https://stackoverflow.com/questions/5821120/301-redirect-to-replace-all-spaces-to-hyphens",
	"id": 690,
	"parentId": "767",
	"dateAddedLocal": "12/18/2019, 7:03:03 PM",
	"dateAddedUTC": "2019-12-19T01:03:03.842Z"
},{
	"index": 7,
	"title": "Accordions â€¹ wyr.es â€” WordPress",
	"url": "http://wyr.es/wp-admin/edit.php?post_type=accordions",
	"id": 694,
	"parentId": "767",
	"dateAddedLocal": "12/18/2019, 8:42:15 PM",
	"dateAddedUTC": "2019-12-19T02:42:15.042Z"
},{
	"index": 8,
	"title": "Media Library â€¹ wyr.es â€” WordPress",
	"url": "http://wyr.es/wp-admin/upload.php",
	"id": 687,
	"parentId": "767",
	"dateAddedLocal": "12/20/2019, 4:17:58 PM",
	"dateAddedUTC": "2019-12-20T22:17:58.831Z"
},{
	"index": 9,
	"title": "Customize: Loadingâ€¦",
	"url": "http://wyr.es/wp-admin/customize.php?return=%2Fwp-admin%2Fupload.php#undefined",
	"id": 698,
	"parentId": "767",
	"dateAddedLocal": "12/20/2019, 4:20:35 PM",
	"dateAddedUTC": "2019-12-20T22:20:35.647Z"
},{
	"index": 10,
	"title": "Pages â€¹ wyr.es â€” WordPress",
	"url": "http://wyr.es/wp-admin/edit.php?post_type=page",
	"id": 688,
	"parentId": "767",
	"dateAddedLocal": "12/21/2019, 3:33:43 PM",
	"dateAddedUTC": "2019-12-21T21:33:43.142Z"
},{
	"index": 11,
	"title": "Change Colors in a PNG - Online PNG Tools",
	"url": "https://onlinepngtools.com/change-png-color",
	"id": 695,
	"parentId": "767",
	"dateAddedLocal": "12/21/2019, 3:58:27 PM",
	"dateAddedUTC": "2019-12-21T21:58:27.254Z"
},{
	"index": 1,
	"title": "ðŸ”—Wyres",
	"id": 768,
	"parentId": "766",
	"dateAddedLocal": "10/8/2020, 1:47:45 PM",
	"dateAddedUTC": "2020-10-08T18:47:45.102Z"
},{
	"index": 0,
	"title": "add link",
	"url": "http://wyr.es/wp-admin/admin.php?page=url_shortener_add",
	"id": 677,
	"parentId": "768",
	"dateAddedLocal": "5/2/2019, 1:25:14 PM",
	"dateAddedUTC": "2019-05-02T18:25:14.505Z"
},{
	"index": 1,
	"title": "edit links",
	"url": "http://wyr.es/wp-admin/admin.php?page=url_shortener_links",
	"id": 675,
	"parentId": "768",
	"dateAddedLocal": "7/15/2019, 11:41:35 AM",
	"dateAddedUTC": "2019-07-15T16:41:35.847Z"
},{
	"index": 2,
	"title": "wedo",
	"url": "https://drive.google.com/drive/folders/1vUSu4wAwcA7tyJiPgF4BXYkVw5yW8cdY",
	"id": 673,
	"parentId": "768",
	"dateAddedLocal": "10/31/2019, 2:32:31 PM",
	"dateAddedUTC": "2019-10-31T19:32:31.226Z"
},{
	"index": 3,
	"title": "Getting Started Tutorial - Google Chrome",
	"url": "https://developer.chrome.com/extensions/getstarted",
	"id": 674,
	"parentId": "768",
	"dateAddedLocal": "1/9/2020, 10:32:19 PM",
	"dateAddedUTC": "2020-01-10T04:32:19.454Z"
},{
	"index": 4,
	"title": "ref",
	"url": "http://www.citationmachine.net/items/1434976382/copy",
	"id": 676,
	"parentId": "768",
	"dateAddedLocal": "1/11/2020, 7:45:45 PM",
	"dateAddedUTC": "2020-01-12T01:45:45.250Z"
},{
	"index": 2,
	"title": "ðŸ”Žsearch",
	"id": 890,
	"parentId": "766",
	"dateAddedLocal": "10/8/2020, 1:51:33 PM",
	"dateAddedUTC": "2020-10-08T18:51:33.495Z"
},{
	"index": 0,
	"title": "search",
	"url": "https://stackoverflow.com/questions/23576315/search-box-to-pass-value-to-url-without-symbol",
	"id": 684,
	"parentId": "890",
	"dateAddedLocal": "12/14/2019, 5:34:57 PM",
	"dateAddedUTC": "2019-12-14T23:34:57.121Z"
},{
	"index": 1,
	"title": "google ?q=",
	"url": "https://www.google.com/search?q=search+box+without+%3Fq%3D&oq=search+box+without+%3Fq%3D&aqs=chrome..69i57.4134j0j4&sourceid=chrome&ie=UTF-8",
	"id": 680,
	"parentId": "890",
	"dateAddedLocal": "12/14/2019, 5:35:33 PM",
	"dateAddedUTC": "2019-12-14T23:35:33.608Z"
},{
	"index": 2,
	"title": "search2",
	"url": "http://wyr.es/wp-admin/post.php?post=232&action=edit",
	"id": 682,
	"parentId": "890",
	"dateAddedLocal": "12/14/2019, 5:36:05 PM",
	"dateAddedUTC": "2019-12-14T23:36:05.400Z"
},{
	"index": 3,
	"title": "mod_rewrite - Apache HTTP Server Version 2.4",
	"url": "https://httpd.apache.org/docs/current/mod/mod_rewrite.html",
	"id": 679,
	"parentId": "890",
	"dateAddedLocal": "12/15/2019, 4:18:13 PM",
	"dateAddedUTC": "2019-12-15T22:18:13.520Z"
},{
	"index": 4,
	"title": "A Pen by Captain Anonymous",
	"url": "https://codepen.io/anon/pen/kjyAF",
	"id": 685,
	"parentId": "890",
	"dateAddedLocal": "12/15/2019, 5:08:51 PM",
	"dateAddedUTC": "2019-12-15T23:08:51.296Z"
},{
	"index": 5,
	"title": "remove + or spaces from search results html htaccess - Google Search",
	"url": "https://www.google.com/search?sxsrf=ACYBGNThY6Te1R_PegnJhqdCWWSkCmnKRQ%3A1576474258078&ei=khb3XZK1BNurtQbns5SYAg&q=remove+%2B+or+spaces+from+search+results+html+htaccess&oq=remove+%2B+or+spaces+from+search+results+html+htaccess&gs_l=psy-ab.3...1371.2758..2873...0.2..0.97.721.9......0....1..gws-wiz.......0i71j33i22i29i30j33i160j33i299.0aXs5MnSF0Q&ved=0ahUKEwiSxpmhuLnmAhXbVc0KHecZBSMQ4dUDCAs&uact=5",
	"id": 681,
	"parentId": "890",
	"dateAddedLocal": "12/15/2019, 11:42:51 PM",
	"dateAddedUTC": "2019-12-16T05:42:51.452Z"
},{
	"index": 6,
	"title": "php - Remove plus sign from url using .htaccess - Stack Overflow",
	"url": "https://stackoverflow.com/questions/30996025/remove-plus-sign-from-url-using-htaccess",
	"id": 683,
	"parentId": "890",
	"dateAddedLocal": "12/15/2019, 11:52:38 PM",
	"dateAddedUTC": "2019-12-16T05:52:38.454Z"
},{
	"index": 7,
	"title": "Introduction To URL Rewriting â€” Smashing Magazine",
	"url": "https://www.smashingmagazine.com/2011/11/introduction-to-url-rewriting/",
	"id": 686,
	"parentId": "890",
	"dateAddedLocal": "12/16/2019, 12:00:56 AM",
	"dateAddedUTC": "2019-12-16T06:00:56.543Z"
},{
	"index": 3,
	"title": "ðŸ¥¢food",
	"id": 776,
	"parentId": "766",
	"dateAddedLocal": "10/8/2020, 1:51:33 PM",
	"dateAddedUTC": "2020-10-08T18:51:33.477Z"
},{
	"index": 0,
	"title": "Low FODMAP Foods | Foods for a Low FODMAP Diet | Fody Foods",
	"url": "https://www.fodyfoods.com/",
	"id": 672,
	"parentId": "776",
	"dateAddedLocal": "12/7/2019, 4:56:54 PM",
	"dateAddedUTC": "2019-12-07T22:56:54.683Z"
},{
	"index": 4,
	"title": "Esp",
	"id": 777,
	"parentId": "766",
	"dateAddedLocal": "10/8/2020, 1:51:33 PM",
	"dateAddedUTC": "2020-10-08T18:51:33.478Z"
},{
	"index": 0,
	"title": "Los 10 mejores podcast en espaÃ±ol - Facundo Leites - Medium",
	"url": "https://medium.com/@facundoleites/los-10-mejores-podcast-en-espa%C3%B1ol-4e7c72f71132",
	"id": 678,
	"parentId": "777",
	"dateAddedLocal": "11/14/2019, 10:23:27 PM",
	"dateAddedUTC": "2019-11-15T04:23:27.345Z"
},{
	"index": 5,
	"title": "More",
	"id": 778,
	"parentId": "766",
	"dateAddedLocal": "10/8/2020, 1:51:33 PM",
	"dateAddedUTC": "2020-10-08T18:51:33.478Z"
},{
	"index": 0,
	"title": "fech",
	"id": 885,
	"parentId": "778",
	"dateAddedLocal": "10/8/2020, 1:51:33 PM",
	"dateAddedUTC": "2020-10-08T18:51:33.494Z"
},{
	"index": 0,
	"title": "Craigslist - Fech Email - Google Docs",
	"url": "https://docs.google.com/document/d/1O3r58lQPFZQu3gRF5zgl2GW2YJ_9r5NRw_8iRoT4VzI/edit",
	"id": 889,
	"parentId": "885",
	"dateAddedLocal": "7/30/2018, 11:59:50 PM",
	"dateAddedUTC": "2018-07-31T04:59:50.005Z"
},{
	"index": 1,
	"title": "seattle gigs - craigslist",
	"url": "https://seattle.craigslist.org/search/ggg",
	"id": 650,
	"parentId": "885",
	"dateAddedLocal": "7/31/2018, 4:51:33 PM",
	"dateAddedUTC": "2018-07-31T21:51:33.003Z"
},{
	"index": 2,
	"title": "bend gigs - craigslist",
	"url": "https://bend.craigslist.org/d/gigs/search/ggg",
	"id": 886,
	"parentId": "885",
	"dateAddedLocal": "7/31/2018, 5:09:24 PM",
	"dateAddedUTC": "2018-07-31T22:09:24.254Z"
},{
	"index": 3,
	"title": "portland gigs - craigslist",
	"url": "https://portland.craigslist.org/search/ggg",
	"id": 887,
	"parentId": "885",
	"dateAddedLocal": "7/31/2018, 5:12:40 PM",
	"dateAddedUTC": "2018-07-31T22:12:40.134Z"
},{
	"index": 4,
	"title": "Craigslist Ads Houston - Google Sheets",
	"url": "https://docs.google.com/spreadsheets/d/1nLq05Zn6wWqKdAYM9Ny7SzYggNbTn8ms3U5rIL7JwIQ/edit#gid=0",
	"id": 888,
	"parentId": "885",
	"dateAddedLocal": "8/3/2018, 11:32:22 AM",
	"dateAddedUTC": "2018-08-03T16:32:22.058Z"
},{
	"index": 5,
	"title": "los angeles gigs - craigslist",
	"url": "https://losangeles.craigslist.org/search/ggg?",
	"id": 649,
	"parentId": "885",
	"dateAddedLocal": "8/3/2018, 11:50:37 AM",
	"dateAddedUTC": "2018-08-03T16:50:37.476Z"
},{
	"index": 1,
	"title": "notary",
	"id": 866,
	"parentId": "778",
	"dateAddedLocal": "10/8/2020, 1:51:33 PM",
	"dateAddedUTC": "2020-10-08T18:51:33.491Z"
},{
	"index": 0,
	"title": "9 Step Checklist to Become a Successful Loan Signing Agent WITHOUT Any Experience - Loan Signing Agent Course",
	"url": "https://www.loansigningsystem.com/9steps.html?utm_source=email&utm_medium=lssnotary_drip&utm_campaign=9steps&utm_content=webpage",
	"id": 877,
	"parentId": "866",
	"dateAddedLocal": "8/8/2018, 4:46:33 PM",
	"dateAddedUTC": "2018-08-08T21:46:33.445Z"
},{
	"index": 1,
	"title": "Loan Signing System Course and Certification",
	"url": "https://courses.loansigningsystem.com/courses/take/bundle/lessons/1521137-lesson-1-two-questions-every-borrower-asks",
	"id": 870,
	"parentId": "866",
	"dateAddedLocal": "8/8/2018, 5:03:33 PM",
	"dateAddedUTC": "2018-08-08T22:03:33.228Z"
},{
	"index": 2,
	"title": "GOVERNMENT CODE",
	"url": "https://www.nationalnotary.org/file%20library/nna/reference-library/state-law-summaries/texas.pdf",
	"id": 876,
	"parentId": "866",
	"dateAddedLocal": "8/8/2018, 5:03:49 PM",
	"dateAddedUTC": "2018-08-08T22:03:49.050Z"
},{
	"index": 3,
	"title": "Texas Notary Packages - Become a TX Notary | NNA",
	"url": "https://www.nationalnotary.org/texas/become-a-notary/package",
	"id": 875,
	"parentId": "866",
	"dateAddedLocal": "8/8/2018, 5:03:55 PM",
	"dateAddedUTC": "2018-08-08T22:03:55.586Z"
},{
	"index": 4,
	"title": "notary services to join - Google Sheets",
	"url": "https://docs.google.com/spreadsheets/d/1mNEbjMOKDvobRS4D38YR4mtOIuDGZn9FXcoPPRL4bgU/edit#gid=0",
	"id": 872,
	"parentId": "866",
	"dateAddedLocal": "8/15/2018, 12:46:34 PM",
	"dateAddedUTC": "2018-08-15T17:46:34.429Z"
},{
	"index": 5,
	"title": "Student Dash",
	"url": "https://courses.loansigningsystem.com/enrollments",
	"id": 871,
	"parentId": "866",
	"dateAddedLocal": "8/15/2018, 12:54:16 PM",
	"dateAddedUTC": "2018-08-15T17:54:16.504Z"
},{
	"index": 6,
	"title": "notary $$ - Google Sheets",
	"url": "https://docs.google.com/spreadsheets/d/1BuyVpe3SNM1KWmvFAIAZMJEdoLbz5TRN0cFOJCrn4ZU/edit#gid=0",
	"id": 873,
	"parentId": "866",
	"dateAddedLocal": "8/15/2018, 1:05:09 PM",
	"dateAddedUTC": "2018-08-15T18:05:09.283Z"
},{
	"index": 7,
	"title": "Notary To Do - Google Docs",
	"url": "https://docs.google.com/document/d/1jAjJy0Nn4vmy5YbDgZEULUtS5nIAa5Wfm4u9QsOuepQ/edit",
	"id": 868,
	"parentId": "866",
	"dateAddedLocal": "8/15/2018, 2:51:40 PM",
	"dateAddedUTC": "2018-08-15T19:51:40.404Z"
},{
	"index": 8,
	"title": "Cart | NNA",
	"url": "https://www.nationalnotary.org/shopping-cart",
	"id": 874,
	"parentId": "866",
	"dateAddedLocal": "8/15/2018, 5:02:24 PM",
	"dateAddedUTC": "2018-08-15T22:02:24.920Z"
},{
	"index": 9,
	"title": "Loan Signing System Certification",
	"url": "https://docs.google.com/forms/d/e/1FAIpQLScDZg8lQUA_4luZhb2W0h6PKAyPLwHvXZbkeCmXnYH8NvZHQg/viewform?c=0&w=1",
	"id": 867,
	"parentId": "866",
	"dateAddedLocal": "9/12/2018, 9:53:51 AM",
	"dateAddedUTC": "2018-09-12T14:53:51.046Z"
},{
	"index": 10,
	"title": "19:13cÂ¿Y como termina? - Omar Cabrera - YouTube",
	"url": "https://www.youtube.com/watch?v=bPteqX7xy-k",
	"id": 869,
	"parentId": "866",
	"dateAddedLocal": "9/13/2018, 6:41:52 PM",
	"dateAddedUTC": "2018-09-13T23:41:52.227Z"
},{
	"index": 11,
	"title": "notary quiz + - Google Docs",
	"url": "https://docs.google.com/document/d/1OC7cKCfOcczD6VwxcEEC3j-Ng1Pg1n0mdzNs1lYX4fU/edit",
	"id": 878,
	"parentId": "866",
	"dateAddedLocal": "9/13/2018, 7:11:29 PM",
	"dateAddedUTC": "2018-09-14T00:11:29.970Z"
},{
	"index": 12,
	"title": "2218-Loan Signing System Course and Certification",
	"url": "https://courses.loansigningsystem.com/courses/take/bundle/lessons/1521138-lesson-2-the-key-to-filling-out-forms",
	"id": 879,
	"parentId": "866",
	"dateAddedLocal": "10/2/2018, 1:14:56 PM",
	"dateAddedUTC": "2018-10-02T18:14:56.455Z"
},{
	"index": 2,
	"title": "NRS",
	"id": 857,
	"parentId": "778",
	"dateAddedLocal": "10/8/2020, 1:51:33 PM",
	"dateAddedUTC": "2020-10-08T18:51:33.490Z"
},{
	"index": 0,
	"title": "nursing school application process - Google Sheets",
	"url": "https://docs.google.com/spreadsheets/d/1k4aBLzq0ckwSNMWbYsjlxYU_UHDb43FdCHIJwTPZEpU/edit#gid=0",
	"id": 862,
	"parentId": "857",
	"dateAddedLocal": "7/19/2018, 3:54:45 PM",
	"dateAddedUTC": "2018-07-19T20:54:45.704Z"
},{
	"index": 1,
	"title": "Hospital Volunteering - Google Docs",
	"url": "https://docs.google.com/document/d/1OoAg4ULTK85N_dM6CWZSWlBRCUDLm5cmrbD1Vgrtwc0/edit",
	"id": 865,
	"parentId": "857",
	"dateAddedLocal": "7/24/2018, 5:11:48 PM",
	"dateAddedUTC": "2018-07-24T22:11:48.997Z"
},{
	"index": 2,
	"title": "StraighterLine_ACE_CREDIT_Transfer_Checklist.pdf",
	"url": "https://www.straighterline.com/wp/wp-content/uploads/2014/07/StraighterLine_ACE_CREDIT_Transfer_Checklist.pdf",
	"id": 863,
	"parentId": "857",
	"dateAddedLocal": "7/24/2018, 6:28:55 PM",
	"dateAddedUTC": "2018-07-24T23:28:55.198Z"
},{
	"index": 3,
	"title": "English Composition 101 Course Online for Credit | StraighterLine",
	"url": "https://www.straighterline.com/eng101xxmghsl001000001-b.html",
	"id": 859,
	"parentId": "857",
	"dateAddedLocal": "7/24/2018, 6:29:02 PM",
	"dateAddedUTC": "2018-07-24T23:29:02.464Z"
},{
	"index": 4,
	"title": "UT Application Process - Google Docs",
	"url": "https://docs.google.com/document/d/1-5eOUc-Jsvoc3i_NrYTftq7-Uwh-QXqDkmb8ILPx9fU/edit",
	"id": 864,
	"parentId": "857",
	"dateAddedLocal": "6/30/2018, 3:00:46 PM",
	"dateAddedUTC": "2018-06-30T20:00:46.182Z"
},{
	"index": 5,
	"title": "Philosophy syllabus check - Google Docs",
	"url": "https://docs.google.com/document/d/13Fs_Cp21GxvulTpFUiEb5oyspV37u6lyBVZMxgGzr9M/edit#",
	"id": 861,
	"parentId": "857",
	"dateAddedLocal": "10/5/2018, 3:08:49 PM",
	"dateAddedUTC": "2018-10-05T20:08:49.093Z"
},{
	"index": 6,
	"title": "76b4ac70-37cb-4d1d-9bd5-18a082248770.pdf",
	"url": "https://nursing.uth.edu/dotAsset/76b4ac70-37cb-4d1d-9bd5-18a082248770.pdf",
	"id": 860,
	"parentId": "857",
	"dateAddedLocal": "10/23/2018, 5:04:34 PM",
	"dateAddedUTC": "2018-10-23T22:04:34.646Z"
},{
	"index": 7,
	"title": "E*Value - evalue - The University of Texas Health Science Center at Houston (UTHealth) School of Nursing",
	"url": "https://nursing.uth.edu/evalue/index.htm",
	"id": 858,
	"parentId": "857",
	"dateAddedLocal": "10/23/2018, 5:04:40 PM",
	"dateAddedUTC": "2018-10-23T22:04:40.501Z"
},{
	"index": 3,
	"title": "REL",
	"id": 779,
	"parentId": "778",
	"dateAddedLocal": "10/8/2020, 1:51:33 PM",
	"dateAddedUTC": "2020-10-08T18:51:33.478Z"
},{
	"index": 0,
	"title": "Inbox â€“ nathan.puls@gmail.com",
	"url": "https://inbox.google.com/u/0/?pli=1",
	"id": 781,
	"parentId": "779",
	"dateAddedLocal": "10/5/2018, 3:09:25 PM",
	"dateAddedUTC": "2018-10-05T20:09:25.394Z"
},{
	"index": 1,
	"title": "racekingwood.com",
	"url": "http://racekingwood.com/",
	"id": 746,
	"parentId": "779",
	"dateAddedLocal": "10/5/2018, 3:09:35 PM",
	"dateAddedUTC": "2018-10-05T20:09:35.994Z"
},{
	"index": 2,
	"title": "AP2 Lab Practical 2 - Google Docs",
	"url": "https://docs.google.com/document/d/13LxBxnZK7PHz1pfDlK5xM9h37OQN8-zMUlBegOJ8UFM/edit",
	"id": 785,
	"parentId": "779",
	"dateAddedLocal": "10/3/2018, 11:26:46 AM",
	"dateAddedUTC": "2018-10-03T16:26:46.066Z"
},{
	"index": 3,
	"title": "Sun - YouTube",
	"url": "https://www.youtube.com/watch?v=Z5IjGiRecB8&list=PLTX5JU1m3Q6_VkYXvddQnn-aystUr0IOw&index=1",
	"id": 786,
	"parentId": "779",
	"dateAddedLocal": "10/9/2018, 10:42:57 PM",
	"dateAddedUTC": "2018-10-10T03:42:57.991Z"
},{
	"index": 4,
	"title": "Pat Barrett - Sails (feat. Steffany Gretzinger & Amanda Lindsey Cook) (Live) - YouTube",
	"url": "https://www.youtube.com/watch?v=rC7mNAsx7Vw",
	"id": 780,
	"parentId": "779",
	"dateAddedLocal": "10/12/2018, 9:22:41 PM",
	"dateAddedUTC": "2018-10-13T02:22:41.669Z"
},{
	"index": 5,
	"title": "Forever I Run Live Elevation Worship - YouTube",
	"url": "https://www.youtube.com/watch?v=kUXqjQBi-fE",
	"id": 782,
	"parentId": "779",
	"dateAddedLocal": "10/12/2018, 9:42:19 PM",
	"dateAddedUTC": "2018-10-13T02:42:19.191Z"
},{
	"index": 6,
	"title": "Faithful | Live | Elevation Worship - YouTube",
	"url": "https://www.youtube.com/watch?v=KmjUiTGdvko",
	"id": 787,
	"parentId": "779",
	"dateAddedLocal": "10/13/2018, 9:58:15 AM",
	"dateAddedUTC": "2018-10-13T14:58:15.429Z"
},{
	"index": 7,
	"title": "Photo in Micro Exam 2 - Erika Chapter Reviews - Google Photos",
	"url": "https://photos.google.com/share/AF1QipO1IXlyvWEW31Y5xjh5hHVXN2h-7DaE_qFnic_i2aN2RU4maUEMsz4jTjqUJPNg6Q/photo/AF1QipMlqc6KTjzI43fpwEQPeeDAHPhzVobX8pP9pn4x?key=bmNrbGhnRHpsN2g5M3QyNkwwRElkaDBicUtFUjl3",
	"id": 784,
	"parentId": "779",
	"dateAddedLocal": "10/13/2018, 10:22:31 PM",
	"dateAddedUTC": "2018-10-14T03:22:31.519Z"
},{
	"index": 8,
	"title": "Photo in Micro Exam 2 - Erika Chapter Reviews - Google Photos",
	"url": "https://photos.google.com/share/AF1QipO1IXlyvWEW31Y5xjh5hHVXN2h-7DaE_qFnic_i2aN2RU4maUEMsz4jTjqUJPNg6Q/photo/AF1QipNeBJpxBCjNn7CaGPNPt8f46vjdXNLzeG_QMJ1D?key=bmNrbGhnRHpsN2g5M3QyNkwwRElkaDBicUtFUjl3",
	"id": 783,
	"parentId": "779",
	"dateAddedLocal": "10/13/2018, 10:29:02 PM",
	"dateAddedUTC": "2018-10-14T03:29:02.925Z"
},{
	"index": 4,
	"title": "Lonestar",
	"id": 817,
	"parentId": "778",
	"dateAddedLocal": "10/8/2020, 1:51:33 PM",
	"dateAddedUTC": "2020-10-08T18:51:33.484Z"
},{
	"index": 0,
	"title": "AP 2",
	"url": "https://portal.mypearson.com/course-home#/tab/active",
	"id": 822,
	"parentId": "817",
	"dateAddedLocal": "8/31/2018, 2:00:25 PM",
	"dateAddedUTC": "2018-08-31T19:00:25.546Z"
},{
	"index": 1,
	"title": "Micro",
	"url": "https://d2l.lonestar.edu/d2l/le/content/667762/Home",
	"id": 824,
	"parentId": "817",
	"dateAddedLocal": "9/18/2018, 1:54:27 PM",
	"dateAddedUTC": "2018-09-18T18:54:27.447Z"
},{
	"index": 2,
	"title": "Lab Archives",
	"url": "https://mynotebook.labarchives.com/login",
	"id": 831,
	"parentId": "817",
	"dateAddedLocal": "8/28/2018, 2:31:24 PM",
	"dateAddedUTC": "2018-08-28T19:31:24.845Z"
},{
	"index": 3,
	"title": "MAIL 1",
	"url": "https://outlook.office.com/owa/?realm=my.lonestar.edu&exsvurl=1&ll-cc=1033&modurl=0",
	"id": 852,
	"parentId": "817",
	"dateAddedLocal": "9/27/2017, 9:32:00 AM",
	"dateAddedUTC": "2017-09-27T14:32:00.445Z"
},{
	"index": 4,
	"title": "MAIL 2",
	"url": "https://www.office.com/?auth=2",
	"id": 734,
	"parentId": "817",
	"dateAddedLocal": "5/18/2018, 1:19:06 PM",
	"dateAddedUTC": "2018-05-18T18:19:06.246Z"
},{
	"index": 5,
	"title": "my.lonestar.edu",
	"url": "https://my.lonestar.edu/psp/porprd/?cmd=login",
	"id": 856,
	"parentId": "817",
	"dateAddedLocal": "6/4/2018, 11:25:52 PM",
	"dateAddedUTC": "2018-06-05T04:25:52.219Z"
},{
	"index": 6,
	"title": "D2L",
	"url": "https://d2l.lonestar.edu/",
	"id": 727,
	"parentId": "817",
	"dateAddedLocal": "8/14/2018, 2:16:33 PM",
	"dateAddedUTC": "2018-08-14T19:16:33.421Z"
},{
	"index": 7,
	"title": "Gov",
	"url": "https://d2l.lonestar.edu/d2l/le/content/687474/Home",
	"id": 823,
	"parentId": "817",
	"dateAddedLocal": "9/28/2018, 11:45:49 AM",
	"dateAddedUTC": "2018-09-28T16:45:49.522Z"
},{
	"index": 8,
	"title": "Module 3 Discussion Board - GOVT-2305 1024 14A Federal Government",
	"url": "https://d2l.lonestar.edu/d2l/le/687474/discussions/topics/482413/View",
	"id": 853,
	"parentId": "817",
	"dateAddedLocal": "9/27/2018, 3:43:11 PM",
	"dateAddedUTC": "2018-09-27T20:43:11.151Z"
},{
	"index": 9,
	"title": "Courses",
	"url": "https://d2l.lonestar.edu/d2l/home",
	"id": 821,
	"parentId": "817",
	"dateAddedLocal": "4/25/2018, 11:40:19 AM",
	"dateAddedUTC": "2018-04-25T16:40:19.466Z"
},{
	"index": 10,
	"title": "Extra",
	"id": 825,
	"parentId": "817",
	"dateAddedLocal": "10/8/2020, 1:51:33 PM",
	"dateAddedUTC": "2020-10-08T18:51:33.485Z"
},{
	"index": 0,
	"title": "HTML to Text Converter - Transform HTML to Plain Text - Online - Browserling Web Developer Tools",
	"url": "https://www.browserling.com/tools/html-to-text",
	"id": 827,
	"parentId": "825",
	"dateAddedLocal": "6/13/2018, 1:55:25 PM",
	"dateAddedUTC": "2018-06-13T18:55:25.296Z"
},{
	"index": 1,
	"title": "WordCounter",
	"url": "https://wordcounter.net/",
	"id": 642,
	"parentId": "825",
	"dateAddedLocal": "6/11/2018, 4:21:49 PM",
	"dateAddedUTC": "2018-06-11T21:21:49.336Z"
},{
	"index": 2,
	"title": "Grammarly",
	"url": "https://grammarly.com/",
	"id": 828,
	"parentId": "825",
	"dateAddedLocal": "6/10/2018, 9:59:46 PM",
	"dateAddedUTC": "2018-06-11T02:59:46.013Z"
},{
	"index": 3,
	"title": "Viper (antiplagiarism)",
	"url": "https://www.scanmyessay.com/app-viper/documents/396213",
	"id": 830,
	"parentId": "825",
	"dateAddedLocal": "9/21/2018, 5:22:01 PM",
	"dateAddedUTC": "2018-09-21T22:22:01.843Z"
},{
	"index": 4,
	"title": "Chapter 2 - Post-Test Flashcards | Quizlet",
	"url": "https://quizlet.com/231942153/chapter-2-post-test-flash-cards/",
	"id": 829,
	"parentId": "825",
	"dateAddedLocal": "9/20/2018, 2:22:47 PM",
	"dateAddedUTC": "2018-09-20T19:22:47.493Z"
},{
	"index": 5,
	"title": "Chapter 3 - Post-Test Flashcards | Quizlet",
	"url": "https://quizlet.com/232199640/chapter-3-post-test-flash-cards/",
	"id": 826,
	"parentId": "825",
	"dateAddedLocal": "9/20/2018, 2:23:55 PM",
	"dateAddedUTC": "2018-09-20T19:23:55.493Z"
},{
	"index": 11,
	"title": "exam 2 micro - Google Docs",
	"url": "https://docs.google.com/document/d/15B-HFi55veJQJ8DUb4lZGwMcOQdFjDImJck5H767TGU/edit",
	"id": 820,
	"parentId": "817",
	"dateAddedLocal": "10/9/2018, 1:26:33 PM",
	"dateAddedUTC": "2018-10-09T18:26:33.613Z"
},{
	"index": 12,
	"title": "MICRO LAB MASTER DOC - Google Docs",
	"url": "https://docs.google.com/document/d/1gOk97EToY9FXvVbsD6AIvWxmEAADnizlKzlQIH0H-JM/edit",
	"id": 855,
	"parentId": "817",
	"dateAddedLocal": "10/11/2018, 3:34:47 PM",
	"dateAddedUTC": "2018-10-11T20:34:47.642Z"
},{
	"index": 13,
	"title": "View Grades & Feed | Virtual Learning Assistance Center",
	"url": "http://vlac.lonestar.edu/help/viewing-quiz-grades-feedback",
	"id": 854,
	"parentId": "817",
	"dateAddedLocal": "10/18/2018, 12:22:55 PM",
	"dateAddedUTC": "2018-10-18T17:22:55.504Z"
},{
	"index": 14,
	"title": "Paper 2 guidelines - AP2 - COPD - Google Docs",
	"url": "https://docs.google.com/document/d/1CnrSeGZVaEIQTEsokejm93jiLAghiVAbdr8i26gesk4/edit",
	"id": 819,
	"parentId": "817",
	"dateAddedLocal": "10/18/2018, 11:53:10 PM",
	"dateAddedUTC": "2018-10-19T04:53:10.633Z"
},{
	"index": 15,
	"title": "AP 2 - Paper 2 - Google Docs",
	"url": "https://docs.google.com/document/d/1Rvp9KnUp1SPjCv_GCOWpsKnFaP5wIBVmnxc0dAXBj0M/edit",
	"id": 818,
	"parentId": "817",
	"dateAddedLocal": "10/18/2018, 11:53:15 PM",
	"dateAddedUTC": "2018-10-19T04:53:15.642Z"
},{
	"index": 16,
	"title": "Writing Project Instructions - AP2 - Google Docs",
	"url": "https://docs.google.com/document/d/1AxGARWcgsd_YTnk4L1WKp3PewZzzznMhK0LRvEX6ROM/edit",
	"id": 851,
	"parentId": "817",
	"dateAddedLocal": "10/19/2018, 1:29:38 PM",
	"dateAddedUTC": "2018-10-19T18:29:38.718Z"
},{
	"index": 17,
	"title": "Quiz List - GOVT-2305 1024 14A Federal Government - LSCS",
	"url": "https://d2l.lonestar.edu/d2l/lms/quizzing/user/quizzes_list.d2l?ou=687474",
	"id": 850,
	"parentId": "817",
	"dateAddedLocal": "10/25/2018, 8:42:23 PM",
	"dateAddedUTC": "2018-10-26T01:42:23.789Z"
},{
	"index": 18,
	"title": "Micro Paper",
	"id": 832,
	"parentId": "817",
	"dateAddedLocal": "10/8/2020, 1:51:33 PM",
	"dateAddedUTC": "2020-10-08T18:51:33.486Z"
},{
	"index": 0,
	"title": "Hepatitis B - Wikipedia",
	"url": "https://en.wikipedia.org/wiki/Hepatitis_B",
	"id": 848,
	"parentId": "832",
	"dateAddedLocal": "11/6/2018, 4:16:18 PM",
	"dateAddedUTC": "2018-11-06T22:16:18.767Z"
},{
	"index": 1,
	"title": "Questions and Answers | Know Hepatitis B | CDC",
	"url": "https://www.cdc.gov/knowhepatitisb/faqs.htm",
	"id": 847,
	"parentId": "832",
	"dateAddedLocal": "11/6/2018, 4:16:37 PM",
	"dateAddedUTC": "2018-11-06T22:16:37.878Z"
},{
	"index": 2,
	"title": "Citation Machine: American Psychological Association 6th Edition format citation generator for website",
	"url": "http://www.citationmachine.net/bibliographies/369609870?new=true",
	"id": 835,
	"parentId": "832",
	"dateAddedLocal": "11/6/2018, 4:16:30 PM",
	"dateAddedUTC": "2018-11-06T22:16:30.828Z"
},{
	"index": 3,
	"title": "Micro Term Paper - Hepatitis B - Google Docs",
	"url": "https://docs.google.com/document/d/1yFP1dZJFhUOHGE4TU35YdeYSz01fbHFythZNa_Zbdtw/edit#",
	"id": 836,
	"parentId": "832",
	"dateAddedLocal": "11/6/2018, 4:16:55 PM",
	"dateAddedUTC": "2018-11-06T22:16:55.364Z"
},{
	"index": 4,
	"title": "Result List: hepatitis b vector: EBSCOhost",
	"url": "http://web.b.ebscohost.com.lscsproxy.lonestar.edu/ehost/results?vid=3&sid=b1eba8e1-bfeb-4e8a-8022-c8a0e9363040%40pdc-v-sessmgr03&bquery=hepatitis+b+vector&bdata=JkF1dGhUeXBlPWlwLGNwaWQmY3VzdGlkPXMxMDg4NDM1JmRiPWE5aCZ0eXBlPTAmc2l0ZT1laG9zdC1saXZl",
	"id": 849,
	"parentId": "832",
	"dateAddedLocal": "11/6/2018, 4:17:03 PM",
	"dateAddedUTC": "2018-11-06T22:17:03.422Z"
},{
	"index": 5,
	"title": "Basic Search: EBSCOhost",
	"url": "http://web.b.ebscohost.com.lscsproxy.lonestar.edu/ehost/search/basic?vid=0&sid=6086c2e7-18b1-493e-8e9b-4edb4dc4831e%40sessionmgr104",
	"id": 833,
	"parentId": "832",
	"dateAddedLocal": "11/6/2018, 4:17:08 PM",
	"dateAddedUTC": "2018-11-06T22:17:08.292Z"
},{
	"index": 6,
	"title": "Research Databases: Health & Medicine",
	"url": "http://www.lonestar.edu/library/15183.htm",
	"id": 834,
	"parentId": "832",
	"dateAddedLocal": "11/6/2018, 4:17:12 PM",
	"dateAddedUTC": "2018-11-06T22:17:12.602Z"
},{
	"index": 7,
	"title": "Open Tabs",
	"id": 837,
	"parentId": "832",
	"dateAddedLocal": "10/8/2020, 1:51:33 PM",
	"dateAddedUTC": "2020-10-08T18:51:33.487Z"
},{
	"index": 0,
	"title": "Micro Term Paper - Hepatitis B - Google Docs",
	"url": "https://docs.google.com/document/d/1yFP1dZJFhUOHGE4TU35YdeYSz01fbHFythZNa_Zbdtw/edit",
	"id": 841,
	"parentId": "837",
	"dateAddedLocal": "11/8/2018, 10:23:37 PM",
	"dateAddedUTC": "2018-11-09T04:23:37.867Z"
},{
	"index": 1,
	"title": "Hepatitis B Final Paper - Google Docs",
	"url": "https://docs.google.com/document/d/1xYiorUQqBZ3w1nSWbEBgXMxyTbmxNhHVxEFuVIdLJuw/edit",
	"id": 840,
	"parentId": "837",
	"dateAddedLocal": "11/8/2018, 10:23:37 PM",
	"dateAddedUTC": "2018-11-09T04:23:37.868Z"
},{
	"index": 2,
	"title": "Citation Machine: American Psychological Association 6th Edition format citation generator for website",
	"url": "http://www.citationmachine.net/items/900736580/parenthetical",
	"id": 843,
	"parentId": "837",
	"dateAddedLocal": "11/8/2018, 10:23:37 PM",
	"dateAddedUTC": "2018-11-09T04:23:37.868Z"
},{
	"index": 3,
	"title": "Replaces Synonyms, Replaces Antonyms | Thesaurus.com",
	"url": "https://www.thesaurus.com/browse/replace?s=t",
	"id": 846,
	"parentId": "837",
	"dateAddedLocal": "11/8/2018, 10:23:37 PM",
	"dateAddedUTC": "2018-11-09T04:23:37.868Z"
},{
	"index": 4,
	"title": "Hepatitis B - Wikipedia",
	"url": "https://en.wikipedia.org/wiki/Hepatitis_B",
	"id": 845,
	"parentId": "837",
	"dateAddedLocal": "11/8/2018, 10:23:37 PM",
	"dateAddedUTC": "2018-11-09T04:23:37.869Z"
},{
	"index": 5,
	"title": "How do I change the default font in Google Docs? : SmartCloud Support",
	"url": "http://support.smartcloud.ie/support/solutions/articles/3000054918-how-do-i-change-the-default-font-in-google-docs",
	"id": 842,
	"parentId": "837",
	"dateAddedLocal": "11/8/2018, 10:23:37 PM",
	"dateAddedUTC": "2018-11-09T04:23:37.869Z"
},{
	"index": 6,
	"title": "Submission History - BIOL-2420 4105 1 Medical Microbiology - LSCS",
	"url": "https://d2l.lonestar.edu/d2l/lms/dropbox/user/folders_history.d2l?db=536956&grpid=0&isprv=False&bp=0&ou=667762",
	"id": 844,
	"parentId": "837",
	"dateAddedLocal": "11/8/2018, 10:23:37 PM",
	"dateAddedUTC": "2018-11-09T04:23:37.869Z"
},{
	"index": 7,
	"title": "Submission History - BIOL-2420 4105 1 Medical Microbiology - LSCS",
	"url": "file:///Users/nathanpuls/Desktop/Submission%20History%20-%20BIOL-2420%204105%201%20Medical%20Microbiology%20-%20LSCS.htm",
	"id": 839,
	"parentId": "837",
	"dateAddedLocal": "11/8/2018, 10:23:37 PM",
	"dateAddedUTC": "2018-11-09T04:23:37.869Z"
},{
	"index": 8,
	"title": "how to save all open tabs chroe - Google Search",
	"url": "https://www.google.com/search?q=how+to+save+all+open+tabs+chroe&oq=how+to+save+all+open+tabs+chroe&aqs=chrome..69i57j0l3.4355j0j7&sourceid=chrome&ie=UTF-8",
	"id": 838,
	"parentId": "837",
	"dateAddedLocal": "11/8/2018, 10:23:37 PM",
	"dateAddedUTC": "2018-11-09T04:23:37.870Z"
},{
	"index": 5,
	"title": "Viv",
	"id": 788,
	"parentId": "778",
	"dateAddedLocal": "10/8/2020, 1:51:33 PM",
	"dateAddedUTC": "2020-10-08T18:51:33.479Z"
},{
	"index": 0,
	"title": "Texans Energy",
	"url": "https://www.mytexansenergy.com/checkout",
	"id": 795,
	"parentId": "788",
	"dateAddedLocal": "12/13/2018, 11:52:29 AM",
	"dateAddedUTC": "2018-12-13T17:52:29.997Z"
},{
	"index": 1,
	"title": "Texans Energy 7.6",
	"url": "https://www.mytexansenergy.com/shop/PTC",
	"id": 791,
	"parentId": "788",
	"dateAddedLocal": "12/13/2018, 11:53:19 AM",
	"dateAddedUTC": "2018-12-13T17:53:19.691Z"
},{
	"index": 2,
	"title": "Insurance Options",
	"url": "https://www.affordablerentersinsurance.com/Quote_Rates.aspx",
	"id": 798,
	"parentId": "788",
	"dateAddedLocal": "12/13/2018, 11:53:37 AM",
	"dateAddedUTC": "2018-12-13T17:53:37.388Z"
},{
	"index": 3,
	"title": "Option 2-American Family Insurance Quotes for Auto, Home, Life and More | American Family Insurance",
	"url": "https://www.amfam.com/",
	"id": 800,
	"parentId": "788",
	"dateAddedLocal": "12/13/2018, 12:03:58 PM",
	"dateAddedUTC": "2018-12-13T18:03:58.873Z"
},{
	"index": 4,
	"title": "Opt 2-RENTERS INS QUOTE - nathan.puls@gmail.com - Gmail",
	"url": "https://mail.google.com/mail/u/0/#inbox/FMfcgxvzMBqKMVwrthzxRRgswBwsQvCR",
	"id": 797,
	"parentId": "788",
	"dateAddedLocal": "12/13/2018, 12:23:34 PM",
	"dateAddedUTC": "2018-12-13T18:23:34.395Z"
},{
	"index": 5,
	"title": "Opt 1-Nathan, you're almost finished. - nathan.puls@gmail.com - Gmail",
	"url": "https://mail.google.com/mail/u/0/#inbox/FMfcgxvzMBqKDNzgGcthBwQzsjCKlwxD",
	"id": 790,
	"parentId": "788",
	"dateAddedLocal": "12/13/2018, 1:10:54 PM",
	"dateAddedUTC": "2018-12-13T19:10:54.885Z"
},{
	"index": 6,
	"title": "Comparing ATT and Xfinity - Google Docs",
	"url": "https://docs.google.com/document/d/1dT2TUjbK937ZtL3qV7MFLXpkLwZv8HMO_KlKom9k8YY/edit",
	"id": 796,
	"parentId": "788",
	"dateAddedLocal": "12/13/2018, 3:14:30 PM",
	"dateAddedUTC": "2018-12-13T21:14:30.209Z"
},{
	"index": 7,
	"title": "Performance Sheet Set Solids 400 Thread Count - ThresholdÂ™ : Target",
	"url": "https://intl.target.com/p/performance-sheet-set-solids-400-thread-count-threshold-153/-/A-51846287?preselect=14131701#lnk=sametab",
	"id": 792,
	"parentId": "788",
	"dateAddedLocal": "1/2/2019, 5:43:10 AM",
	"dateAddedUTC": "2019-01-02T11:43:10.157Z"
},{
	"index": 8,
	"title": "Amazon.com: Customer reviews: MOTOROLA MG7550 16x4 Cable Modem Plus AC1900 Dual Band Wi-Fi Gigabit Router with Power Boost, 686 Mbps Maximum DOCSIS 3.0 - Approved by Comcast Xfinity, Cox, Charter Spectrum, More (Black)",
	"url": "https://www.amazon.com/MOTOROLA-MG7550-AC1900-Gigabit-Maximum/product-reviews/B01JGT2JI6/ref=cm_cr_dp_d_show_all_btm?ie=UTF8&reviewerType=all_reviews",
	"id": 793,
	"parentId": "788",
	"dateAddedLocal": "1/2/2019, 5:42:21 PM",
	"dateAddedUTC": "2019-01-02T23:42:21.384Z"
},{
	"index": 9,
	"title": "Amazon.com: ARRIS SURFboard SB6190 32x8 DOCSIS 3.0 Cable Modem - Retail Packaging - White: Computers & Accessories",
	"url": "https://www.amazon.com/gp/product/B016PE1X5K/ref=as_li_qf_asin_il_tl?ie=UTF8&tag=20somethi-20&creative=9325&linkCode=as2&creativeASIN=B016PE1X5K&linkId=b0ab39b811bd6f3d20aafea0ab53bbae",
	"id": 799,
	"parentId": "788",
	"dateAddedLocal": "1/2/2019, 6:07:31 PM",
	"dateAddedUTC": "2019-01-03T00:07:31.838Z"
},{
	"index": 10,
	"title": "Amazon.com: NETGEAR AC1200 Dual Band Smart WiFi Router, Gigabit Ethernet (R6230): Computers & Accessories",
	"url": "https://www.amazon.com/gp/product/B0756QFLXP/ref=as_li_qf_asin_il_tl?ie=UTF8&tag=20somethi-20&creative=9325&linkCode=as2&creativeASIN=B0756QFLXP&linkId=a2ecfba25aaf4d0e02d1620e23d914ed",
	"id": 789,
	"parentId": "788",
	"dateAddedLocal": "1/2/2019, 6:08:21 PM",
	"dateAddedUTC": "2019-01-03T00:08:21.272Z"
},{
	"index": 11,
	"title": "USB C to 3.5mm Adapter, Kolpop 2 in 1 Aux Type C: Amazon.co.uk: Electronics",
	"url": "https://www.amazon.co.uk/dp/B07KMRJ26T/ref=asc_df_B07KMRJ26T57822019/?tag=googshopuk-21&creative=22146&creativeASIN=B07KMRJ26T&linkCode=df0&hvadid=309953091299&hvpos=1o3&hvnetw=g&hvrand=6247129985465780709&hvpone=&hvptwo=&hvqmt=&hvdev=t&hvdvcmdl=&hvlocint=&hvlocphy=1006886&hvtargid=pla-611987087714",
	"id": 794,
	"parentId": "788",
	"dateAddedLocal": "1/3/2019, 6:42:12 AM",
	"dateAddedUTC": "2019-01-03T12:42:12.795Z"
},{
	"index": 12,
	"title": "The Viv",
	"url": "https://theviv.residentportal.com/resident_portal/?module=authentication&action=view_login",
	"id": 644,
	"parentId": "788",
	"dateAddedLocal": "2/5/2019, 5:49:56 PM",
	"dateAddedUTC": "2019-02-05T23:49:56.575Z"
},{
	"index": 6,
	"title": "UTH",
	"id": 801,
	"parentId": "778",
	"dateAddedLocal": "10/8/2020, 1:51:33 PM",
	"dateAddedUTC": "2020-10-08T18:51:33.481Z"
},{
	"index": 0,
	"title": "Mail",
	"url": "https://webmail.uth.tmc.edu/owa/#path=/mail",
	"id": 816,
	"parentId": "801",
	"dateAddedLocal": "12/11/2018, 12:06:52 PM",
	"dateAddedUTC": "2018-12-11T18:06:52.617Z"
},{
	"index": 1,
	"title": "VA",
	"url": "https://www.tms.va.gov/SecureAuth35/",
	"id": 739,
	"parentId": "801",
	"dateAddedLocal": "7/26/2019, 3:51:50 PM",
	"dateAddedUTC": "2019-07-26T20:51:50.041Z"
},{
	"index": 2,
	"title": "TB",
	"url": "http://testbankgo.eu/psychiatric-nursing-contemporary-practice-5th-edition-boyd/?fbclid=IwAR3JLSukryrgfwwBpK8aZyYOfU-kButoiBZu75oMy2a62E325lKeFu44Jzc",
	"id": 807,
	"parentId": "801",
	"dateAddedLocal": "7/19/2019, 6:19:05 PM",
	"dateAddedUTC": "2019-07-19T23:19:05.331Z"
},{
	"index": 3,
	"title": "New Students - new - Current Student - The University of Texas Health Science Center at Houston (UTHealth) School of Nursing",
	"url": "https://nursing.uth.edu/currstudent/new/",
	"id": 810,
	"parentId": "801",
	"dateAddedLocal": "10/23/2018, 2:53:27 PM",
	"dateAddedUTC": "2018-10-23T19:53:27.370Z"
},{
	"index": 4,
	"title": "E*Value - evalue - The University of Texas Health Science Center at Houston (UTHealth) School of Nursing",
	"url": "https://nursing.uth.edu/evalue/",
	"id": 809,
	"parentId": "801",
	"dateAddedLocal": "11/1/2018, 7:16:44 PM",
	"dateAddedUTC": "2018-11-02T00:16:44.164Z"
},{
	"index": 5,
	"title": "UTHEALH ORGANIZE - Google Docs",
	"url": "https://docs.google.com/document/d/1E9BWtzMcMBJZlcc19GbXNR6JUDC4I-uxVOs4zgvN6YU/edit#",
	"id": 814,
	"parentId": "801",
	"dateAddedLocal": "11/1/2018, 7:17:00 PM",
	"dateAddedUTC": "2018-11-02T00:17:00.492Z"
},{
	"index": 6,
	"title": "myUTH",
	"url": "https://my.uth.tmc.edu/",
	"id": 535,
	"parentId": "801",
	"dateAddedLocal": "12/8/2018, 11:11:17 AM",
	"dateAddedUTC": "2018-12-08T17:11:17.552Z"
},{
	"index": 7,
	"title": "METRO Q Card",
	"url": "https://qcard.ridemetro.org/user/travelcardDetails.do?card=7704457",
	"id": 802,
	"parentId": "801",
	"dateAddedLocal": "1/11/2019, 9:06:03 AM",
	"dateAddedUTC": "2019-01-11T15:06:03.362Z"
},{
	"index": 8,
	"title": "Health Assessment in Nursing, Sixth Edition",
	"url": "http://thepoint.lww.com/Book/Show/718035",
	"id": 808,
	"parentId": "801",
	"dateAddedLocal": "1/20/2019, 10:42:00 AM",
	"dateAddedUTC": "2019-01-20T16:42:00.535Z"
},{
	"index": 9,
	"title": "UTH",
	"url": "https://docs.google.com/document/d/1E9BWtzMcMBJZlcc19GbXNR6JUDC4I-uxVOs4zgvN6YU/edit",
	"id": 811,
	"parentId": "801",
	"dateAddedLocal": "10/23/2018, 2:51:44 PM",
	"dateAddedUTC": "2018-10-23T19:51:44.411Z"
},{
	"index": 10,
	"title": "Lecture Audio Recordings - Google Drive",
	"url": "https://drive.google.com/drive/folders/1Y31Il96PbF1viZH4stqCZvtzPRgt-ziB?fbclid=IwAR1fd1hxKkSs8riNLMvjLaWe3mKzXyEDVfWkzec_mhK-n7RISRmNuC5-rzw",
	"id": 813,
	"parentId": "801",
	"dateAddedLocal": "1/24/2019, 4:28:51 PM",
	"dateAddedUTC": "2019-01-24T22:28:51.523Z"
},{
	"index": 11,
	"title": "UTH NOW - Google Docs",
	"url": "https://docs.google.com/document/d/1SSH1zqxI0TwCBaPsXuMCczVhRpE8Hk1zEQFFCAySdzQ/edit",
	"id": 804,
	"parentId": "801",
	"dateAddedLocal": "1/29/2019, 6:10:51 PM",
	"dateAddedUTC": "2019-01-30T00:10:51.167Z"
},{
	"index": 12,
	"title": "stephanie_castorani | Quizlet",
	"url": "https://quizlet.com/stephanie_castorani/classes",
	"id": 812,
	"parentId": "801",
	"dateAddedLocal": "2/2/2019, 11:06:18 AM",
	"dateAddedUTC": "2019-02-02T17:06:18.305Z"
},{
	"index": 13,
	"title": "(2) Gail Lupica - YouTube",
	"url": "https://www.youtube.com/channel/UCSz3py472QMh8tkAOyb52nQ/videos",
	"id": 803,
	"parentId": "801",
	"dateAddedLocal": "2/26/2019, 10:18:18 PM",
	"dateAddedUTC": "2019-02-27T04:18:18.219Z"
},{
	"index": 14,
	"title": "Care Plan 1 - Nathan Puls - 3rd Format",
	"url": "https://uthtmc-my.sharepoint.com/:w:/r/personal/nathanael_h_puls_uth_tmc_edu/_layouts/15/Doc.aspx?sourcedoc={4d6f9c23-a9c3-49f7-85b6-2a95c83a3c91}&action=editnew&wdPreviousSession=3221097a%2De0c9%2D4de4%2D9ecb%2Df78fcdb0b414&wdNewAndOpenCt=1552158648804&wdo=4&wdOrigin=wacFileNew&wdTpl=blank&wdLcid=1033&wdPreviousCorrelation=d0a1ecd7%2D73e3%2D44cd%2D9021%2Dfba5a0995f4d",
	"id": 806,
	"parentId": "801",
	"dateAddedLocal": "3/9/2019, 2:03:31 PM",
	"dateAddedUTC": "2019-03-09T20:03:31.584Z"
},{
	"index": 15,
	"title": "Microsoft Word Sign in",
	"url": "https://adfs.uth.edu/adfs/ls/?login_hint=Nathanael.H.Puls%40uth.tmc.edu&mkt=en-US&client-request-id=ecd7ad20-dd49-4cfe-b5c5-37d613fa5911&username=Nathanael.H.Puls%40uth.tmc.edu&wa=wsignin1.0&wtrealm=urn%3afederation%3aMicrosoftOnline&wctx=estsredirect%3d2%26estsrequest%3drQIIAY2TOY_jdBiHJ5OZsDtCywJbbEExxVYgZ_4-Y0daaTOxHTuJjxy2YzeR7yO-4iOHPwHlinIrRLkSDRISQqJCNFttBWglRI9AQlRAgch8g23e4tVT_PR7n_fjNtyF-08szHIc0yUh00JwCCNRFyKJHoAcD1AW5cEOcM3ig6uH11_-9Dv_y3_Tr3_o_fjhv_r7L1tPgqrKy_7NTRn6aZ13k9AusjLzqq6dJTexmTph6n_Tar1utT47_0g0q8BMTTfucl25jstndRV0q8Tuuk794vzSTSFl8fK8JFCC7JEYRgECwwkCIeGungiYtBQ3OqJUYqQ30hAAvfHhqTbeCM2sEhAeEWgbNSKmEUcC0KMgESIF6EumEhod0RcASJqAnPjESITT7sQlAi5qDCZoavTm_D1pcEqD3I2sCBv3r_P7XlYk6zwrqxft79pS7qa8M8zS1LWr7h3mplVom1WYpXKR5W5RhW75lAtZF9-QNUdvevw2hDQL4hvL9Mg9F_HocCxLmbOrJ4rmESl84DQNkUFij8QVl5X0aL5SHbQXmwg9YWNlbIvVlvcwW581gzowdEI_HpblMCAa6kiTJp9ZEezOWbJe58dUD9dHg2WJ1cpijz0Rs3wsabAjpzIqGt81Nl_tgcof51N8ojkANnfFjlnt5j5eu_Zg6qtCGSKbUmHmB6zUx2uFJp3tDCcVOlnWxvaI3zbSSGbX0oG8HWYlOjwIE20-U7RpbgDfWVcgyqh4ELPwpDoqKo67HsKF6ywciMTCZ5DpTpkICJOrZUH5SBju1msWP5hYzmnuIbAzOYaZEeMOWGbJTEbJeETLfm-iDm_BmJAPoVHPvEBfjPbwkt5WNV95FFeHiiTfEoO5O40gDJ4qcCmhReQt-DQPcHaXo6ZJgWm1_6rdOfmYZOmr9oPTqdLQuc6LzAtj9_VF67eLd8Fl_969q4cPHrevz_6-aH1xeZKd--fXR0v25_HntiH98T179urypjCCXi5O9hoZM6Fa2jvyk1Te00sMpnpzzdqTWLKvC35x4MqnZB9-3mk973T-7LQ-fefs2_tv9Spvrh4hAKYggEIwuEZAH8B9jDD-Bw2",
	"id": 805,
	"parentId": "801",
	"dateAddedLocal": "3/10/2019, 3:01:51 PM",
	"dateAddedUTC": "2019-03-10T20:01:51.428Z"
},{
	"index": 7,
	"title": "Drive",
	"id": 880,
	"parentId": "778",
	"dateAddedLocal": "10/8/2020, 1:51:33 PM",
	"dateAddedUTC": "2020-10-08T18:51:33.493Z"
},{
	"index": 0,
	"title": "My Drive",
	"url": "https://drive.google.com/drive/my-drive",
	"id": 643,
	"parentId": "880",
	"dateAddedLocal": "7/2/2018, 5:13:54 PM",
	"dateAddedUTC": "2018-07-02T22:13:54.235Z"
},{
	"index": 1,
	"title": "New",
	"url": "https://docs.google.com/document/u/0/create",
	"id": 883,
	"parentId": "880",
	"dateAddedLocal": "5/29/2016, 5:30:53 PM",
	"dateAddedUTC": "2016-05-29T22:30:53.760Z"
},{
	"index": 2,
	"title": "New",
	"url": "http://sheets.google.com/create",
	"id": 881,
	"parentId": "880",
	"dateAddedLocal": "5/16/2018, 2:29:14 PM",
	"dateAddedUTC": "2018-05-16T19:29:14.694Z"
},{
	"index": 3,
	"title": "Invoice",
	"url": "https://docs.google.com/spreadsheets/d/1RAiKopKtdN0YesRRgPUT1xWc_rE-vGAOImooO3VDyJ0/edit#gid=0",
	"id": 882,
	"parentId": "880",
	"dateAddedLocal": "6/8/2018, 2:35:13 PM",
	"dateAddedUTC": "2018-06-08T19:35:13.260Z"
},{
	"index": 4,
	"title": "Calendar",
	"url": "https://calendar.google.com/calendar/render#main_7%7Clist",
	"id": 884,
	"parentId": "880",
	"dateAddedLocal": "9/7/2016, 11:28:16 AM",
	"dateAddedUTC": "2016-09-07T16:28:16.695Z"
},{
	"index": 8,
	"title": "My List",
	"url": "https://getpocket.com/a/queue/",
	"id": 629,
	"parentId": "778",
	"dateAddedLocal": "3/15/2019, 6:37:04 PM",
	"dateAddedUTC": "2019-03-15T23:37:04.373Z"
},{
	"index": 9,
	"title": "VOS",
	"url": "https://docs.google.com/document/d/11FiyA0O77YGqxmT9Nb83Xf2nirrph8C4xV7gWptjOko/edit",
	"id": 630,
	"parentId": "778",
	"dateAddedLocal": "8/28/2019, 9:13:36 PM",
	"dateAddedUTC": "2019-08-29T02:13:36.658Z"
},{
	"index": 10,
	"title": "J2",
	"url": "https://drive.google.com/drive/folders/1VqJnOVKqK6F_dvB_AxPHblAoVOFImbck",
	"id": 631,
	"parentId": "778",
	"dateAddedLocal": "6/6/2019, 11:07:16 AM",
	"dateAddedUTC": "2019-06-06T16:07:16.276Z"
},{
	"index": 6,
	"title": "honeymoon",
	"id": 891,
	"parentId": "766",
	"dateAddedLocal": "10/8/2020, 1:51:33 PM",
	"dateAddedUTC": "2020-10-08T18:51:33.495Z"
},{
	"index": 0,
	"title": "Hotel Photos | The Westin Golf Resort & Spa, Playa Conchal â€“ All-Inclusive Photo Gallery",
	"url": "https://www.marriott.com/hotels/hotel-photos/lirwi-the-westin-golf-resort-and-spa-playa-conchal-all-inclusive/",
	"id": 671,
	"parentId": "891",
	"dateAddedLocal": "1/7/2020, 10:45:37 PM",
	"dateAddedUTC": "2020-01-08T04:45:37.693Z"
},{
	"index": 7,
	"title": "Medical",
	"id": 775,
	"parentId": "766",
	"dateAddedLocal": "10/8/2020, 1:51:33 PM",
	"dateAddedUTC": "2020-10-08T18:51:33.477Z"
},{
	"index": 0,
	"title": "tddc portal",
	"url": "https://tddctx.mygportal.com/PP69/Account/LogOn",
	"id": 663,
	"parentId": "775",
	"dateAddedLocal": "2/28/2020, 11:19:47 AM",
	"dateAddedUTC": "2020-02-28T17:19:47.850Z"
},{
	"index": 8,
	"title": "<>",
	"id": 909,
	"parentId": "766",
	"dateAddedLocal": "10/16/2020, 1:41:56 PM",
	"dateAddedUTC": "2020-10-16T18:41:56.902Z"
},{
	"index": 0,
	"title": "codepen",
	"url": "https://codepen.io/pen/",
	"id": 908,
	"parentId": "909",
	"dateAddedLocal": "10/16/2020, 1:25:46 PM",
	"dateAddedUTC": "2020-10-16T18:25:46.926Z"
},{
	"index": 1,
	"title": "php",
	"url": "https://www.tutorialrepublic.com/php-tutorial/php-data-types.php",
	"id": 910,
	"parentId": "909",
	"dateAddedLocal": "10/16/2020, 1:42:03 PM",
	"dateAddedUTC": "2020-10-16T18:42:03.789Z"
},{
	"index": 2,
	"title": "js",
	"url": "https://javascript.info/variables",
	"id": 911,
	"parentId": "909",
	"dateAddedLocal": "10/16/2020, 1:49:15 PM",
	"dateAddedUTC": "2020-10-16T18:49:15.226Z"
},{
	"index": 3,
	"title": "sql",
	"url": "https://www.tutorialrepublic.com/sql-tutorial/sql-create-database-statement.php",
	"id": 912,
	"parentId": "909",
	"dateAddedLocal": "10/16/2020, 1:49:41 PM",
	"dateAddedUTC": "2020-10-16T18:49:41.009Z"
},{
	"index": 4,
	"title": "Netlify",
	"url": "https://app.netlify.com/sites/wyres/settings/general",
	"id": 914,
	"parentId": "909",
	"dateAddedLocal": "10/22/2020, 6:09:00 PM",
	"dateAddedUTC": "2020-10-22T23:09:00.227Z"
},{
	"index": 5,
	"title": "Contentful",
	"url": "https://app.contentful.com/spaces/1b4lic6ux5ho/home",
	"id": 915,
	"parentId": "909",
	"dateAddedLocal": "10/22/2020, 6:10:43 PM",
	"dateAddedUTC": "2020-10-22T23:10:43.636Z"
},{
	"index": 6,
	"title": "React",
	"url": "https://reactjs.org/",
	"id": 916,
	"parentId": "909",
	"dateAddedLocal": "10/22/2020, 6:11:09 PM",
	"dateAddedUTC": "2020-10-22T23:11:09.974Z"
},{
	"index": 7,
	"title": "Snap.svg",
	"url": "http://snapsvg.io/",
	"id": 917,
	"parentId": "909",
	"dateAddedLocal": "10/22/2020, 6:12:21 PM",
	"dateAddedUTC": "2020-10-22T23:12:21.761Z"
},{
	"index": 8,
	"title": "Gatsby",
	"url": "https://www.gatsbyjs.com/",
	"id": 918,
	"parentId": "909",
	"dateAddedLocal": "10/22/2020, 6:13:29 PM",
	"dateAddedUTC": "2020-10-22T23:13:29.720Z"
},{
	"index": 9,
	"title": "Varnish (software) - Wikipedia",
	"url": "https://en.wikipedia.org/wiki/Varnish_(software)",
	"id": 919,
	"parentId": "909",
	"dateAddedLocal": "10/22/2020, 6:14:58 PM",
	"dateAddedUTC": "2020-10-22T23:14:58.052Z"
},{
	"index": 10,
	"title": "IFTTT",
	"url": "https://platform.ifttt.com/docs",
	"id": 921,
	"parentId": "909",
	"dateAddedLocal": "10/22/2020, 9:07:27 PM",
	"dateAddedUTC": "2020-10-23T02:07:27.629Z"
},{
	"index": 11,
	"title": "A Smarter Way to Learn JavaScript - Index of JavaScript Exercises",
	"url": "http://asmarterwaytolearn.com/js/index-of-exercises.html",
	"id": 925,
	"parentId": "909",
	"dateAddedLocal": "11/5/2020, 10:10:44 AM",
	"dateAddedUTC": "2020-11-05T16:10:44.258Z"
},{
	"index": 12,
	"title": "mongoQuick Start â€” Node.js",
	"url": "https://docs.mongodb.com/drivers/node/quick-start",
	"id": 928,
	"parentId": "909",
	"dateAddedLocal": "11/5/2020, 4:07:38 PM",
	"dateAddedUTC": "2020-11-05T22:07:38.347Z"
},{
	"index": 13,
	"title": "Clusters | Atlas: MongoDB Atlas",
	"url": "https://cloud.mongodb.com/v2/5fa1c58f7045f209fd5b9ba9#clusters",
	"id": 929,
	"parentId": "909",
	"dateAddedLocal": "11/5/2020, 4:07:52 PM",
	"dateAddedUTC": "2020-11-05T22:07:52.038Z"
},{
	"index": 14,
	"title": "Heroku",
	"url": "https://dashboard.heroku.com/apps/wyresweb/resources",
	"id": 930,
	"parentId": "909",
	"dateAddedLocal": "11/5/2020, 4:08:01 PM",
	"dateAddedUTC": "2020-11-05T22:08:01.431Z"
},{
	"index": 15,
	"title": "Add Firebase to your JavaScript project",
	"url": "https://firebase.google.com/docs/web/setup?authuser=0",
	"id": 931,
	"parentId": "909",
	"dateAddedLocal": "11/5/2020, 9:00:47 PM",
	"dateAddedUTC": "2020-11-06T03:00:47.136Z"
},{
	"index": 16,
	"title": "Code Map - Google Docs",
	"url": "https://docs.google.com/document/d/15gwGy7tm46jf2X7mHDjBgzPQyZ7hY2hn0X5XAtBdFjQ/edit#",
	"id": 935,
	"parentId": "909",
	"dateAddedLocal": "11/6/2020, 1:24:53 PM",
	"dateAddedUTC": "2020-11-06T19:24:53.261Z"
},{
	"index": 17,
	"title": "Learn React: Create a Simple JSX Element | freeCodeCamp.org",
	"url": "https://www.freecodecamp.org/learn/front-end-libraries/react/create-a-simple-jsx-element",
	"id": 937,
	"parentId": "909",
	"dateAddedLocal": "11/12/2020, 4:41:40 PM",
	"dateAddedUTC": "2020-11-12T22:41:40.289Z"
},{
	"index": 18,
	"title": "Learn the MERN Stack - Full Tutorial for Beginners (MongoDB, Express, React, NodeJS) in 12Hrs (2021) - YouTube",
	"url": "https://www.youtube.com/watch?v=ktjafK4SgWM",
	"id": 938,
	"parentId": "909",
	"dateAddedLocal": "11/12/2020, 5:04:44 PM",
	"dateAddedUTC": "2020-11-12T23:04:44.866Z"
},{
	"index": 19,
	"title": "NodeJS + MongoDB - Simple API for Authentication,â€¦",
	"url": "https://jasonwatmore.com/post/2018/06/14/nodejs-mongodb-simple-api-for-authentication-registration-and-user-management",
	"id": 945,
	"parentId": "909",
	"dateAddedLocal": "11/18/2020, 6:55:25 PM",
	"dateAddedUTC": "2020-11-19T00:55:25.997Z"
},{
	"index": 20,
	"title": "Easily Deploy a Fullstack Next.js App with Vercelâ€¦",
	"url": "https://scotch.io/tutorials/easily-deploy-a-fullstack-nextjs-app-with-vercel",
	"id": 944,
	"parentId": "909",
	"dateAddedLocal": "11/18/2020, 6:58:57 PM",
	"dateAddedUTC": "2020-11-19T00:58:57.933Z"
},{
	"index": 21,
	"title": "onderonur/onurl: URL Shortener created w/ Next.js, TypeScript, Mongoose",
	"url": "https://github.com/onderonur/onurl",
	"id": 947,
	"parentId": "909",
	"dateAddedLocal": "11/20/2020, 1:39:28 PM",
	"dateAddedUTC": "2020-11-20T19:39:28.933Z"
},{
	"index": 22,
	"title": "Material UI React Tutorial - YouTube",
	"url": "https://www.youtube.com/watch?v=vyJU9efvUtQ",
	"id": 953,
	"parentId": "909",
	"dateAddedLocal": "11/25/2020, 4:07:56 PM",
	"dateAddedUTC": "2020-11-25T22:07:56.590Z"
},{
	"index": 23,
	"title": "Introduction Â· Learn Javascript",
	"url": "https://gitbookio.gitbooks.io/javascript/content/",
	"id": 954,
	"parentId": "909",
	"dateAddedLocal": "11/29/2020, 8:32:55 PM",
	"dateAddedUTC": "2020-11-30T02:32:55.680Z"
},{
	"index": 24,
	"title": "9 Popular GitHub Repos For Every Web Developer -â€¦",
	"url": "https://dev.to/simonholdorf/9-popular-github-repos-for-every-web-developer-31ej",
	"id": 955,
	"parentId": "909",
	"dateAddedLocal": "12/3/2020, 12:42:44 PM",
	"dateAddedUTC": "2020-12-03T18:42:44.290Z"
},{
	"index": 25,
	"title": "Repl.it - Build your very own URL shortener ðŸ”—ðŸš€",
	"url": "https://repl.it/talk/learn/Build-your-very-own-URL-shortener/9611",
	"id": 958,
	"parentId": "909",
	"dateAddedLocal": "12/4/2020, 1:24:25 PM",
	"dateAddedUTC": "2020-12-04T19:24:25.126Z"
},{
	"index": 26,
	"title": "cheat sheet",
	"id": 960,
	"parentId": "909",
	"dateAddedLocal": "12/4/2020, 3:59:17 PM",
	"dateAddedUTC": "2020-12-04T21:59:17.137Z"
},{
	"index": 0,
	"title": "10 VS Code shortcuts to memorize that will boost your productivity",
	"url": "https://travis.media/10-vs-code-shortcuts-to-memorize-that-will-boost-your-productivity/#vs-code-shortcuts-cheatsheet",
	"id": 959,
	"parentId": "960",
	"dateAddedLocal": "12/4/2020, 3:59:00 PM",
	"dateAddedUTC": "2020-12-04T21:59:00.871Z"
},{
	"index": 27,
	"title": "Learn TypeScript from the ground up with James Heâ€¦",
	"url": "https://typescriptcourses.com/typescript-fundamentals",
	"id": 962,
	"parentId": "909",
	"dateAddedLocal": "12/5/2020, 5:18:08 PM",
	"dateAddedUTC": "2020-12-05T23:18:08.394Z"
},{
	"index": 28,
	"title": "macros",
	"id": 949,
	"parentId": "909",
	"dateAddedLocal": "11/23/2020, 10:04:39 AM",
	"dateAddedUTC": "2020-11-23T16:04:39.838Z"
},{
	"index": 0,
	"title": "#hsm.rpa",
	"url": "javascript:(function() {try {var evt = new CustomEvent('kantuRunMacro', {detail: {name: \"hsm\",from: 'bookmark',storageMode: 'browser',closeRPA: 1}});window.dispatchEvent(evt);} catch (e) {alert('UI.Vision RPA Bookmarklet error: ' + e.toString());}})();",
	"id": 948,
	"parentId": "949",
	"dateAddedLocal": "11/23/2020, 10:01:49 AM",
	"dateAddedUTC": "2020-11-23T16:01:49.185Z"
},{
	"index": 1,
	"title": "#emailBekah.rpa",
	"url": "javascript:(function() {try {var evt = new CustomEvent('kantuRunMacro', {detail: {name: \"emailBekah\",from: 'bookmark',storageMode: 'browser',closeRPA: 1}});window.dispatchEvent(evt);} catch (e) {alert('UI.Vision RPA Bookmarklet error: ' + e.toString());}})();",
	"id": 950,
	"parentId": "949",
	"dateAddedLocal": "11/23/2020, 10:07:43 AM",
	"dateAddedUTC": "2020-11-23T16:07:43.591Z"
},{
	"index": 29,
	"title": "Recent",
	"id": 771,
	"parentId": "909",
	"dateAddedLocal": "10/8/2020, 1:47:48 PM",
	"dateAddedUTC": "2020-10-08T18:47:48.994Z"
},{
	"index": 0,
	"title": "Thank You | PACE Mental Health Houston",
	"url": "https://www.pacementalhealthhouston.com/contact-pace-houston/thank-you/",
	"id": 540,
	"parentId": "771",
	"dateAddedLocal": "4/26/2020, 4:33:08 PM",
	"dateAddedUTC": "2020-04-26T21:33:08.516Z"
},{
	"index": 1,
	"title": "Growing Deeper TOGETHER - Living on the Edge",
	"url": "https://livingontheedge.org/at-home/daily-discipleship-growing-deeper-together/",
	"id": 537,
	"parentId": "771",
	"dateAddedLocal": "4/30/2020, 8:55:44 AM",
	"dateAddedUTC": "2020-04-30T13:55:44.613Z"
},{
	"index": 2,
	"title": "Moment: A Daily Devotional by Houston's First Baptist Church - Issuu",
	"url": "https://issuu.com/houstonsfirst/docs/moment_-_a_daily_devotional/6?ff&hideShareButton=true",
	"id": 538,
	"parentId": "771",
	"dateAddedLocal": "4/30/2020, 9:40:14 AM",
	"dateAddedUTC": "2020-04-30T14:40:14.556Z"
},{
	"index": 3,
	"title": "Desmos | Scientific Calculator",
	"url": "https://www.desmos.com/scientific",
	"id": 539,
	"parentId": "771",
	"dateAddedLocal": "4/30/2020, 10:17:31 AM",
	"dateAddedUTC": "2020-04-30T15:17:31.237Z"
},{
	"index": 4,
	"title": "Vintage EQ plug-ins in Logic Pro X | MusicTech",
	"url": "https://www.musictech.net/tutorials/vintage-eq-plug-ins-logic-pro-x/",
	"id": 564,
	"parentId": "771",
	"dateAddedLocal": "5/5/2020, 9:15:16 AM",
	"dateAddedUTC": "2020-05-05T14:15:16.938Z"
},{
	"index": 5,
	"title": "May 5 ",
	"id": 565,
	"parentId": "771",
	"dateAddedLocal": "5/5/2020, 10:57:31 AM",
	"dateAddedUTC": "2020-05-05T15:57:31.133Z"
},{
	"index": 0,
	"title": "New folder",
	"id": 566,
	"parentId": "565",
	"dateAddedLocal": "5/5/2020, 10:57:31 AM",
	"dateAddedUTC": "2020-05-05T15:57:31.133Z"
},{
	"index": 0,
	"title": "Nathanael H. Puls - RN Interview - natepuls@gmail.com - Gmail",
	"url": "https://mail.google.com/mail/u/0/#search/skype/FMfcgxwHNCwHRKxKqSLbRWRGnnTgHQrL",
	"id": 567,
	"parentId": "566",
	"dateAddedLocal": "5/5/2020, 10:57:31 AM",
	"dateAddedUTC": "2020-05-05T15:57:31.133Z"
},{
	"index": 1,
	"title": "Skype for Business",
	"url": "https://meet.lync.com/nhsltd/jbrown/MQS6R34M",
	"id": 568,
	"parentId": "566",
	"dateAddedLocal": "5/5/2020, 10:57:31 AM",
	"dateAddedUTC": "2020-05-05T15:57:31.133Z"
},{
	"index": 2,
	"title": "Virtual Recording Studio Experience | Slate Digital",
	"url": "https://slatedigital.com/vrs-experience/#unlockform",
	"id": 569,
	"parentId": "566",
	"dateAddedLocal": "5/5/2020, 10:57:31 AM",
	"dateAddedUTC": "2020-05-05T15:57:31.134Z"
},{
	"index": 3,
	"title": "Catholic Health Initiatives Careers - Jobs",
	"url": "https://chi2.referrals.selectminds.com/",
	"id": 570,
	"parentId": "566",
	"dateAddedLocal": "5/5/2020, 10:57:31 AM",
	"dateAddedUTC": "2020-05-05T15:57:31.134Z"
},{
	"index": 4,
	"title": "remove mouth sound with logic pro x - Google Search",
	"url": "https://www.google.com/search?safe=active&sxsrf=ALeKk01dx_47SrWrSTcitnWGC_QsNQyrXw%3A1588548366778&ei=DlOvXsKNL4bYsAXEpJTIBw&q=remove+mouth+sound+with+logic+pro+x&oq=remove+mouth+sound+with+logic+pro+x&gs_lcp=CgZwc3ktYWIQAzIICCEQFhAdEB46BAgAEEc6BAgjECc6BQgAEJECOgQIABBDOgIIADoFCAAQgwE6BwgAEBQQhwI6BggAEBYQHjoICAAQFhAKEB46BQghEKABOgUIIRCrAlCZUliTeWCfemgAcAR4AIABmgGIAakXkgEEMzAuNZgBAKABAaoBB2d3cy13aXo&sclient=psy-ab&ved=0ahUKEwjCzPDo65jpAhUGLKwKHUQSBXkQ4dUDCAw&uact=5",
	"id": 571,
	"parentId": "566",
	"dateAddedLocal": "5/5/2020, 10:57:31 AM",
	"dateAddedUTC": "2020-05-05T15:57:31.134Z"
},{
	"index": 5,
	"title": "UWorld NCLEX-RN QBank",
	"url": "https://www.uworld.com/ClientApp/V2/apps/Qbank/index.html#/launchtest/5916945/pearson/168687928/2/1",
	"id": 572,
	"parentId": "566",
	"dateAddedLocal": "5/5/2020, 10:57:31 AM",
	"dateAddedUTC": "2020-05-05T15:57:31.135Z"
},{
	"index": 6,
	"title": "How to get warm sounding vocals with Logic plugins - Logic Pro Help",
	"url": "https://www.logicprohelp.com/forum/viewtopic.php?t=24745",
	"id": 573,
	"parentId": "566",
	"dateAddedLocal": "5/5/2020, 10:57:31 AM",
	"dateAddedUTC": "2020-05-05T15:57:31.135Z"
},{
	"index": 7,
	"title": "slate microphone - Google Search",
	"url": "https://www.google.com/search?q=slate+microphone&oq=slate+mic&aqs=chrome.1.69i57j0l4j69i60l2j69i61.2759j0j7&sourceid=chrome&ie=UTF-8",
	"id": 574,
	"parentId": "566",
	"dateAddedLocal": "5/5/2020, 10:57:31 AM",
	"dateAddedUTC": "2020-05-05T15:57:31.135Z"
},{
	"index": 8,
	"title": "SHARE VO - Google Drive",
	"url": "https://drive.google.com/drive/folders/1EpcyK1guiQwxZ1TZ74xojAAd-fiY3mJR",
	"id": 575,
	"parentId": "566",
	"dateAddedLocal": "5/5/2020, 10:57:31 AM",
	"dateAddedUTC": "2020-05-05T15:57:31.135Z"
},{
	"index": 9,
	"title": "buy ilok - Google Search",
	"url": "https://www.google.com/search?safe=active&sxsrf=ALeKk01XAAsSyWpx4ERP8aV0zrOBjAXkVA%3A1588631857093&ei=MZmwXqOiBZG0sQWb-7WoAQ&q=buy+ilok&oq=buy+ilok&gs_lcp=CgZwc3ktYWIQAzIECAAQQzIHCAAQFBCHAjICCAAyBAgAEEMyAggAMgIIADIGCAAQBxAeMgIIADIGCAAQBxAeMgYIABAHEB46BAgAEEdQqipYqipgqTNoAHACeACAAWqIAWqSAQMwLjGYAQCgAQGqAQdnd3Mtd2l6&sclient=psy-ab&ved=0ahUKEwjj_pTsopvpAhURWqwKHZt9DRUQ4dUDCAw&uact=5",
	"id": 576,
	"parentId": "566",
	"dateAddedLocal": "5/5/2020, 10:57:31 AM",
	"dateAddedUTC": "2020-05-05T15:57:31.135Z"
},{
	"index": 10,
	"title": "logic pro x voice over vintage eq voice over - Google Search",
	"url": "https://www.google.com/search?safe=active&sxsrf=ALeKk00nUenxQF2WvYL3eKLyEDM45hI--A%3A1588692945525&ei=0YexXqu-H8nGsAWF8abIAg&q=logic+pro+x+voice+over+vintage+eq+voice+over&oq=logic+pro+x+voice+over+vintage+eq+voice+over&gs_lcp=CgZwc3ktYWIQAzIHCCEQChCgAToECAAQRzoFCCEQqwI6BQghEKABUPNCWPtKYNFLaABwAngBgAHMAYgB7gqSAQUyLjYuMpgBAKABAaoBB2d3cy13aXo&sclient=psy-ab&ved=0ahUKEwjr6rK1hp3pAhVJI6wKHYW4CSkQ4dUDCAw&uact=5",
	"id": 577,
	"parentId": "566",
	"dateAddedLocal": "5/5/2020, 10:57:31 AM",
	"dateAddedUTC": "2020-05-05T15:57:31.136Z"
},{
	"index": 11,
	"title": "Nuemann TLM 103 - Gearslutz",
	"url": "https://www.gearslutz.com/board/rap-hip-hop-engineering-and-production/1214055-nuemann-tlm-103-a.html",
	"id": 578,
	"parentId": "566",
	"dateAddedLocal": "5/5/2020, 10:57:31 AM",
	"dateAddedUTC": "2020-05-05T15:57:31.136Z"
},{
	"index": 12,
	"title": "Apogee Duet 2 vs Apollo Twin Duo (for a broke songwriter). - Gearslutz",
	"url": "https://www.gearslutz.com/board/music-computers/984053-apogee-duet-2-vs-apollo-twin-duo-broke-songwriter.html",
	"id": 579,
	"parentId": "566",
	"dateAddedLocal": "5/5/2020, 10:57:31 AM",
	"dateAddedUTC": "2020-05-05T15:57:31.136Z"
},{
	"index": 13,
	"title": "Question about Neve 1073 - Gearslutz",
	"url": "https://www.gearslutz.com/board/so-much-gear-so-little-time/968994-question-about-neve-1073-a.html",
	"id": 580,
	"parentId": "566",
	"dateAddedLocal": "5/5/2020, 10:57:31 AM",
	"dateAddedUTC": "2020-05-05T15:57:31.136Z"
},{
	"index": 14,
	"title": "RX 7 De-click",
	"url": "https://www.izotope.com/en/products/rx/features/de-click.html",
	"id": 581,
	"parentId": "566",
	"dateAddedLocal": "5/5/2020, 10:57:31 AM",
	"dateAddedUTC": "2020-05-05T15:57:31.137Z"
},{
	"index": 15,
	"title": "Adding iZotope Plugins into Logic Pro X â€“ Help Center",
	"url": "https://support.splice.com/hc/en-us/articles/115013171068-Adding-iZotope-Plugins-into-Logic-Pro-X",
	"id": 582,
	"parentId": "566",
	"dateAddedLocal": "5/5/2020, 10:57:31 AM",
	"dateAddedUTC": "2020-05-05T15:57:31.137Z"
},{
	"index": 6,
	"title": "NOTES",
	"url": "https://wyr.es/notes",
	"id": 752,
	"parentId": "771",
	"dateAddedLocal": "10/2/2020, 12:40:06 PM",
	"dateAddedUTC": "2020-10-02T17:40:06.576Z"
},{
	"index": 7,
	"title": "names",
	"url": "https://www.slat.es/names/",
	"id": 753,
	"parentId": "771",
	"dateAddedLocal": "10/2/2020, 3:41:52 PM",
	"dateAddedUTC": "2020-10-02T20:41:52.010Z"
},{
	"index": 8,
	"title": "slates, nav, search2",
	"url": "https://codepen.io/nathanpuls/pen/pobzmdq",
	"id": 755,
	"parentId": "771",
	"dateAddedLocal": "10/6/2020, 1:54:47 PM",
	"dateAddedUTC": "2020-10-06T18:54:47.496Z"
},{
	"index": 9,
	"title": "TLDRify",
	"url": "javascript:(function(d)%7Bd.body.appendChild(d.createElement(%27script%27)).src%3D%27//tldrify.com/static/js/bookmarklet.min.js%3F_%27%2Bnew%20Date().getTime()%3B%7D)(document)%3B",
	"id": 933,
	"parentId": "771",
	"dateAddedLocal": "11/6/2020, 7:20:00 AM",
	"dateAddedUTC": "2020-11-06T13:20:00.315Z"
},{
	"index": 10,
	"title": "Google Bookmark",
	"url": "javascript:(function()%7Bvar%20a%3Dwindow,b%3Ddocument,c%3DencodeURIComponent,d%3Da.open(%22https://www.google.com/bookmarks/mark%3Fop%3Dedit%26output%3Dpopup%26bkmk%3D%22%2Bc(b.location)%2B%22%26title%3D%22%2Bc(b.title),%22bkmk_popup%22,%22left%3D%22%2B((a.screenX%7C%7Ca.screenLeft)%2B10)%2B%22,top%3D%22%2B((a.screenY%7C%7Ca.screenTop)%2B10)%2B%22,height%3D510px,width%3D550px,resizable%3D1,alwaysRaised%3D1%22)%3Ba.setTimeout(function()%7Bd.focus()%7D,300)%7D)()%3B",
	"id": 932,
	"parentId": "771",
	"dateAddedLocal": "11/6/2020, 7:10:21 AM",
	"dateAddedUTC": "2020-11-06T13:10:21.464Z"
},{
	"index": 30,
	"title": "",
	"url": "https://web.whatsapp.com/",
	"id": 483,
	"parentId": "909",
	"dateAddedLocal": "5/29/2018, 6:22:47 PM",
	"dateAddedUTC": "2018-05-29T23:22:47.161Z"
},{
	"index": 31,
	"title": "",
	"url": "https://www.heb.com/",
	"id": 500,
	"parentId": "909",
	"dateAddedLocal": "2/20/2020, 8:53:29 PM",
	"dateAddedUTC": "2020-02-21T02:53:29.818Z"
},{
	"index": 32,
	"title": "REPL",
	"url": "https://svelte.dev/apps",
	"id": 973,
	"parentId": "909",
	"dateAddedLocal": "2/1/2021, 3:05:16 PM",
	"dateAddedUTC": "2021-02-01T21:05:16.715Z"
},{
	"index": 33,
	"title": "fwd",
	"url": "https://github.com/nathanpuls/fwdng",
	"id": 971,
	"parentId": "909",
	"dateAddedLocal": "1/27/2021, 11:52:00 AM",
	"dateAddedUTC": "2021-01-27T17:52:00.581Z"
},{
	"index": 34,
	"title": "Repo",
	"url": "https://github.com/nathanpuls?tab=repositories",
	"id": 964,
	"parentId": "909",
	"dateAddedLocal": "12/9/2020, 2:18:26 PM",
	"dateAddedUTC": "2020-12-09T20:18:26.711Z"
},{
	"index": 35,
	"title": "forum",
	"url": "https://forum.bubble.io/",
	"id": 986,
	"parentId": "909",
	"dateAddedLocal": "3/21/2021, 5:53:12 PM",
	"dateAddedUTC": "2021-03-21T22:53:12.858Z"
},{
	"index": 36,
	"title": "1",
	"url": "https://bubble.io/page?type=page&name=question&id=airdev-bootcamp-puls&tab=tabs-1",
	"id": 979,
	"parentId": "909",
	"dateAddedLocal": "3/15/2021, 1:44:24 PM",
	"dateAddedUTC": "2021-03-15T18:44:24.038Z"
},{
	"index": 37,
	"title": "FWD",
	"url": "https://fwdng.com/version-test/profile",
	"id": 982,
	"parentId": "909",
	"dateAddedLocal": "3/19/2021, 1:42:14 PM",
	"dateAddedUTC": "2021-03-19T18:42:14.932Z"
},{
	"index": 9,
	"title": "ðŸŽ™ï¸VO",
	"id": 772,
	"parentId": "766",
	"dateAddedLocal": "10/8/2020, 1:47:48 PM",
	"dateAddedUTC": "2020-10-08T18:47:48.995Z"
},{
	"index": 0,
	"title": "vo mkt",
	"url": "https://drive.google.com/drive/folders/1gDwbE2g9n9sYIDyBoSU_yiv_kQK3KYe4",
	"id": 552,
	"parentId": "772",
	"dateAddedLocal": "3/5/2020, 6:43:05 PM",
	"dateAddedUTC": "2020-03-06T00:43:05.698Z"
},{
	"index": 1,
	"title": "Invoice",
	"url": "https://www.paypal.com/invoice/manage",
	"id": 541,
	"parentId": "772",
	"dateAddedLocal": "9/10/2019, 4:06:57 PM",
	"dateAddedUTC": "2019-09-10T21:06:57.947Z"
},{
	"index": 2,
	"title": "WeTransfer",
	"url": "https://wetransfer.com/",
	"id": 561,
	"parentId": "772",
	"dateAddedLocal": "9/10/2019, 3:57:45 PM",
	"dateAddedUTC": "2019-09-10T20:57:45.132Z"
},{
	"index": 3,
	"title": "*Voice Over - Google Drive",
	"url": "https://drive.google.com/drive/folders/0B9enQCxX3s5nbS1kQTc5VFRTM1k?fbclid=IwAR0nj9AXtCvcuxrTbcefnirZIxD8yB9NMD4bKNIYaSVYJAMDqXUU146wx6E",
	"id": 550,
	"parentId": "772",
	"dateAddedLocal": "2/9/2019, 12:40:50 PM",
	"dateAddedUTC": "2019-02-09T18:40:50.059Z"
},{
	"index": 4,
	"title": "Nathan_preps - Dropbox",
	"url": "https://www.dropbox.com/sh/1vwp8wcpgxhjlsb/AABWevjumCKmduR8MFD2aKL2a?dl=0",
	"id": 544,
	"parentId": "772",
	"dateAddedLocal": "7/12/2018, 4:25:01 PM",
	"dateAddedUTC": "2018-07-12T21:25:01.539Z"
},{
	"index": 5,
	"title": "VO - European Cities - Google Sheets",
	"url": "https://docs.google.com/spreadsheets/d/1IYekrcm3bzJqzvBOylkluYoJ25OoNCewP1N0kxnw-6o/edit#gid=0",
	"id": 557,
	"parentId": "772",
	"dateAddedLocal": "7/25/2018, 6:21:41 PM",
	"dateAddedUTC": "2018-07-25T23:21:41.302Z"
},{
	"index": 6,
	"title": "Script",
	"url": "https://docs.google.com/document/d/1cZNWOQF5ZGb0bhkfAMKj_Sivzyc0TPfBDw08ZGze4Ek/edit",
	"id": 545,
	"parentId": "772",
	"dateAddedLocal": "3/19/2017, 1:11:11 PM",
	"dateAddedUTC": "2017-03-19T18:11:11.096Z"
},{
	"index": 7,
	"title": "All Projects - MyPostProduction.com",
	"url": "https://mypostproduction.com/projects/all_projects?sort=DESC&budget=100&description=&category[]=8&languages[]=80&gender=male",
	"id": 556,
	"parentId": "772",
	"dateAddedLocal": "9/17/2018, 7:49:53 PM",
	"dateAddedUTC": "2018-09-18T00:49:53.573Z"
},{
	"index": 8,
	"title": "Source-Connect Now / Online",
	"url": "https://now.source-elements.com/now/#!/82a8f10c5e9/78191a6e-7194-46c3-a57c-c4fba3154fec",
	"id": 562,
	"parentId": "772",
	"dateAddedLocal": "11/14/2018, 8:09:59 AM",
	"dateAddedUTC": "2018-11-14T14:09:59.369Z"
},{
	"index": 9,
	"title": "logo",
	"id": 774,
	"parentId": "772",
	"dateAddedLocal": "10/8/2020, 1:47:48 PM",
	"dateAddedUTC": "2020-10-08T18:47:48.997Z"
},{
	"index": 0,
	"title": "Remove Background from Image â€“ remove.bg",
	"url": "https://www.remove.bg/",
	"id": 721,
	"parentId": "774",
	"dateAddedLocal": "9/8/2019, 9:24:39 AM",
	"dateAddedUTC": "2019-09-08T14:24:39.350Z"
},{
	"index": 1,
	"title": "Online Image color picker",
	"url": "https://pinetools.com/image-color-picker",
	"id": 723,
	"parentId": "774",
	"dateAddedLocal": "9/8/2019, 9:24:51 AM",
	"dateAddedUTC": "2019-09-08T14:24:51.454Z"
},{
	"index": 2,
	"title": "Croppola - online photo cropping",
	"url": "https://croppola.com/",
	"id": 722,
	"parentId": "774",
	"dateAddedLocal": "9/8/2019, 9:30:02 AM",
	"dateAddedUTC": "2019-09-08T14:30:02.549Z"
},{
	"index": 10,
	"title": "cool vo websites",
	"id": 773,
	"parentId": "772",
	"dateAddedLocal": "10/8/2020, 1:47:48 PM",
	"dateAddedUTC": "2020-10-08T18:47:48.997Z"
},{
	"index": 0,
	"title": "Professional Female Voice Over Talent & Actress | Debbie Grattan",
	"url": "https://www.debbiegrattan.com/",
	"id": 699,
	"parentId": "773",
	"dateAddedLocal": "9/9/2019, 10:27:14 PM",
	"dateAddedUTC": "2019-09-10T03:27:14.211Z"
},{
	"index": 11,
	"title": "Voice Over Studio Soundproofing - Google Docs",
	"url": "https://docs.google.com/document/d/111jhvkYGU9iLL3fnrWuSMFa30025B7XDUSiG8CAsFUM/edit#",
	"id": 549,
	"parentId": "772",
	"dateAddedLocal": "2/2/2020, 10:24:39 AM",
	"dateAddedUTC": "2020-02-02T16:24:39.493Z"
},{
	"index": 12,
	"title": "Neumann TLM-103 Condenser Microphone Nickel - Mint OBO - musical...",
	"url": "https://goldcountry.craigslist.org/msg/d/auburn-neumann-tlm-103-condenser/7058296183.html?lang=fr&cc=ca",
	"id": 547,
	"parentId": "772",
	"dateAddedLocal": "2/6/2020, 7:29:02 PM",
	"dateAddedUTC": "2020-02-07T01:29:02.482Z"
},{
	"index": 13,
	"title": "Used Neumann TLM103 Condenser Microphone | Guitar Center",
	"url": "https://www.guitarcenter.com/Used/Neumann/TLM103-Condenser-Microphone-115787362.gc?rNtt=neumann%20tlm%20103&index=5",
	"id": 542,
	"parentId": "772",
	"dateAddedLocal": "2/6/2020, 7:32:35 PM",
	"dateAddedUTC": "2020-02-07T01:32:35.321Z"
},{
	"index": 14,
	"title": "Voice Over Studio Costs - Google Sheets",
	"url": "https://docs.google.com/spreadsheets/d/1jendDRUKFVZs2JjYGVK5RrIJScTiWe7OCUWC42WTIWk/edit#gid=0",
	"id": 543,
	"parentId": "772",
	"dateAddedLocal": "2/9/2020, 4:35:18 PM",
	"dateAddedUTC": "2020-02-09T22:35:18.304Z"
},{
	"index": 15,
	"title": "416",
	"url": "https://www.searchtempest.com/search?search_string=Mkh%20416&category=8&subcat=sss&cityselect=zip&location=77019&maxDist=50000&Region=combined",
	"id": 555,
	"parentId": "772",
	"dateAddedLocal": "2/22/2020, 12:57:32 AM",
	"dateAddedUTC": "2020-02-22T06:57:32.609Z"
},{
	"index": 16,
	"title": "Voice Over Studio Soundproofing - Google Docs",
	"url": "https://docs.google.com/document/d/111jhvkYGU9iLL3fnrWuSMFa30025B7XDUSiG8CAsFUM/edit",
	"id": 548,
	"parentId": "772",
	"dateAddedLocal": "3/6/2020, 10:58:45 PM",
	"dateAddedUTC": "2020-03-07T04:58:45.486Z"
},{
	"index": 17,
	"title": "Book a Support or Information session | Source Elements",
	"url": "https://phoenix.source-elements.com/book/",
	"id": 558,
	"parentId": "772",
	"dateAddedLocal": "3/10/2020, 11:52:45 AM",
	"dateAddedUTC": "2020-03-10T16:52:45.257Z"
},{
	"index": 18,
	"title": "2tonstudio - Google Search",
	"url": "https://www.google.com/search?q=tonstudio&biw=1643&bih=858&sxsrf=ALeKk02ogbU8PoFGtXkQwkrQr1AS2fLjiw:1584062161528&ei=0d5qXqbrH5DKswWq1a3IDQ&start=200&sa=N&ved=2ahUKEwjml8Kzo5boAhUQ5awKHapqC9k4vgEQ8NMDegQICxBA",
	"id": 553,
	"parentId": "772",
	"dateAddedLocal": "3/12/2020, 8:32:38 PM",
	"dateAddedUTC": "2020-03-13T01:32:38.874Z"
},{
	"index": 19,
	"title": "Amazon.com Associates Central - Home",
	"url": "https://affiliate-program.amazon.com/home",
	"id": 554,
	"parentId": "772",
	"dateAddedLocal": "3/17/2020, 4:43:07 PM",
	"dateAddedUTC": "2020-03-17T21:43:07.182Z"
},{
	"index": 20,
	"title": "2 Neumann U 87ai professional studio microphones - musical...",
	"url": "https://chicago.craigslist.org/chc/msg/d/chicago-2-neumann-87ai-professional/7105192760.html",
	"id": 551,
	"parentId": "772",
	"dateAddedLocal": "4/12/2020, 12:50:35 AM",
	"dateAddedUTC": "2020-04-12T05:50:35.003Z"
},{
	"index": 21,
	"title": "Neumann U 87 Ai Set Z with Shockmount | ESR Productions | Reverb",
	"url": "https://reverb.com/item/32957343-neumann-u-87-ai-set-z-with-shockmount",
	"id": 559,
	"parentId": "772",
	"dateAddedLocal": "4/12/2020, 1:07:16 AM",
	"dateAddedUTC": "2020-04-12T06:07:16.226Z"
},{
	"index": 22,
	"title": "Neumann U 87 Ai SET Z Condenser Wired Professional Microphone for sale online | eBay",
	"url": "https://www.ebay.com/p/69796972?iid=173971735944&chn=ps&norover=1&mkevt=1&mkrid=711-117182-37290-0&mkcid=2&itemid=173971735944&targetid=883313841093&device=c&mktype=pla&googleloc=9027582&poi=&campaignid=9418891400&mkgroupid=96614824478&rlsatarget=aud-622524041518:pla-883313841093&abcId=1141016&merchantid=6296724&gclid=CjwKCAjw1cX0BRBmEiwAy9tKHtm1Ctzi66zUww1kKH1Gl_WYdT5xZwY3UqGMzNeXTkzN8VKAylO2yhoC6coQAvD_BwE",
	"id": 560,
	"parentId": "772",
	"dateAddedLocal": "4/12/2020, 1:12:41 AM",
	"dateAddedUTC": "2020-04-12T06:12:41.502Z"
},{
	"index": 23,
	"title": "Used Neumann U87 Ai Silver | Sweetwater Marketplace",
	"url": "https://www.sweetwater.com/used/listings/19038-used-neumann-neumann-u87-ai-silver",
	"id": 546,
	"parentId": "772",
	"dateAddedLocal": "4/12/2020, 1:22:08 AM",
	"dateAddedUTC": "2020-04-12T06:22:08.927Z"
},{
	"index": 10,
	"title": "Settings - Manage search engines and site search",
	"url": "chrome://settings/searchEngines",
	"id": 1085,
	"parentId": "766",
	"dateAddedLocal": "1/23/2024, 8:45:09 PM",
	"dateAddedUTC": "2024-01-24T02:45:09.996Z"
},{
	"index": 1,
	"title": "dev",
	"url": "http://127.0.0.1:5500/",
	"id": 1081,
	"parentId": "1101",
	"dateAddedLocal": "1/13/2024, 12:17:04 PM",
	"dateAddedUTC": "2024-01-13T18:17:04.255Z"
},{
	"index": 2,
	"title": "AI ChatGPT",
	"url": "https://chat.openai.com/c/8166b848-14c5-4c8c-8b34-993109bac391",
	"id": 1083,
	"parentId": "1101",
	"dateAddedLocal": "1/19/2024, 4:16:12 PM",
	"dateAddedUTC": "2024-01-19T22:16:12.173Z"
},{
	"index": 3,
	"title": "DR drive",
	"url": "https://drive.google.com/drive/u/0/home",
	"id": 1079,
	"parentId": "1101",
	"dateAddedLocal": "12/29/2023, 9:20:47 PM",
	"dateAddedUTC": "2023-12-30T03:20:47.940Z"
},{
	"index": 4,
	"title": "N Google News",
	"url": "https://news.google.com/foryou?hl=en-US&gl=US&ceid=US%3Aen",
	"id": 1103,
	"parentId": "1101",
	"dateAddedLocal": "11/2/2022, 11:51:25 AM",
	"dateAddedUTC": "2022-11-02T16:51:25.856Z"
},{
	"index": 5,
	"title": "YT YouTube",
	"url": "https://www.youtube.com/",
	"id": 491,
	"parentId": "1101",
	"dateAddedLocal": "11/15/2019, 11:43:18 AM",
	"dateAddedUTC": "2019-11-15T17:43:18.487Z"
},{
	"index": 6,
	"title": "PH Photos",
	"url": "https://photos.google.com/",
	"id": 504,
	"parentId": "1101",
	"dateAddedLocal": "3/15/2019, 6:34:33 PM",
	"dateAddedUTC": "2019-03-15T23:34:33.257Z"
},{
	"index": 7,
	"title": "M Maps",
	"url": "http://maps.google.com/",
	"id": 495,
	"parentId": "1101",
	"dateAddedLocal": "3/15/2019, 6:34:23 PM",
	"dateAddedUTC": "2019-03-15T23:34:23.047Z"
},{
	"index": 8,
	"title": "Neuro experiment",
	"url": "https://qk.rs/b/?url=drive.google.com%2Fdrive%2Ffolders%2F1FNRjeYC49w_upKgGfyf9uupi9x155O8i,uttyler.instructure.com%2Fcourses%2F39265%2Fmodules",
	"id": 1087,
	"parentId": "1101",
	"dateAddedLocal": "1/25/2024, 9:00:34 AM",
	"dateAddedUTC": "2024-01-25T15:00:34.778Z"
},{
	"index": 9,
	"title": "Redirect Example",
	"url": "http://127.0.0.1:5500/chromesearch/index.html?search=y%20",
	"id": 1105,
	"parentId": "1101",
	"dateAddedLocal": "1/28/2024, 3:44:03 PM",
	"dateAddedUTC": "2024-01-28T21:44:03.557Z"
},{
	"index": 10,
	"title": "Docs",
	"id": 1018,
	"parentId": "1101",
	"dateAddedLocal": "2/3/2022, 10:38:09 PM",
	"dateAddedUTC": "2022-02-04T04:38:09.198Z"
},{
	"index": 0,
	"title": "$",
	"url": "https://docs.google.com/spreadsheets/d/1Ws_wxCL_T5_PUgbkiBbiTaoVyKX1ysLxRPM-MykWay4/edit#gid=0",
	"id": 503,
	"parentId": "1018",
	"dateAddedLocal": "6/6/2018, 8:36:02 AM",
	"dateAddedUTC": "2018-06-06T13:36:02.126Z"
},{
	"index": 1,
	"title": "+",
	"url": "https://docs.google.com/spreadsheets/u/0/create",
	"id": 485,
	"parentId": "1018",
	"dateAddedLocal": "9/7/2019, 12:23:52 AM",
	"dateAddedUTC": "2019-09-07T05:23:52.758Z"
},{
	"index": 2,
	"title": "0",
	"url": "https://docs.google.com/document/d/1c4y09oKyTeOIShANgnHsMnlKTj-tSoTwq8XMB-xB-uo/edit",
	"id": 488,
	"parentId": "1018",
	"dateAddedLocal": "3/17/2019, 11:05:28 PM",
	"dateAddedUTC": "2019-03-18T04:05:28.162Z"
},{
	"index": 3,
	"title": "+",
	"url": "https://docs.google.com/document/u/0/create",
	"id": 489,
	"parentId": "1018",
	"dateAddedLocal": "3/15/2019, 6:34:42 PM",
	"dateAddedUTC": "2019-03-15T23:34:42.659Z"
},{
	"index": 4,
	"title": "info",
	"url": "https://docs.google.com/spreadsheets/d/11FBb2_jsZozsA49LaQHTNGcH5gvLBAmNf2e8U2CPSkY/edit#gid=0",
	"id": 497,
	"parentId": "1018",
	"dateAddedLocal": "6/5/2018, 4:50:38 PM",
	"dateAddedUTC": "2018-06-05T21:50:38.587Z"
},{
	"index": 5,
	"title": "Docs",
	"url": "https://docs.google.com/document/u/0/",
	"id": 496,
	"parentId": "1018",
	"dateAddedLocal": "9/7/2019, 12:18:46 AM",
	"dateAddedUTC": "2019-09-07T05:18:46.961Z"
},{
	"index": 6,
	"title": "Sheets",
	"url": "https://docs.google.com/spreadsheets/u/0/",
	"id": 737,
	"parentId": "1018",
	"dateAddedLocal": "6/20/2020, 11:31:32 AM",
	"dateAddedUTC": "2020-06-20T16:31:32.541Z"
},{
	"index": 8,
	"title": "Gem",
	"url": "https://gemini.google.com/app",
	"id": 1150,
	"parentId": "1146",
	"dateAddedLocal": "6/6/2024, 2:40:31 PM",
	"dateAddedUTC": "2024-06-06T19:40:31.840Z"
},{
	"index": 9,
	"title": "endsify",
	"url": "javascript:(async function(){    const url = new URL(window.location);    const searchQuery = url.searchParams.get('q');    if (searchQuery) {        const newLink = `ends.at/${searchQuery.replace(/\\s+/g, '+').toLowerCase()}`;            try {            await navigator.clipboard.writeText(newLink);        } catch (err) {            console.error('Failed to copy the link: ', err);        }    } else {        console.error('No search query found in the URL!');    }})();",
	"id": 1163,
	"parentId": "1146",
	"dateAddedLocal": "10/22/2024, 8:56:16 PM",
	"dateAddedUTC": "2024-10-23T01:56:16.221Z"
},{
	"index": 10,
	"title": "Just The Recipe",
	"url": "javascript:window.location.href='https://justtherecipe.com/?url=%27+encodeURIComponent(window.location.href);",
	"id": 1171,
	"parentId": "1146",
	"dateAddedLocal": "12/16/2024, 8:22:21 PM",
	"dateAddedUTC": "2024-12-17T02:22:21.080Z"
},{
	"index": 6,
	"title": "Tyler",
	"id": 1040,
	"parentId": "1",
	"dateAddedLocal": "11/17/2022, 9:53:45 PM",
	"dateAddedUTC": "2022-11-18T03:53:45.859Z"
},{
	"index": 0,
	"title": "Mail - Nathanael Puls - Outlook",
	"url": "https://outlook.office.com/mail/",
	"id": 1042,
	"parentId": "1040",
	"dateAddedLocal": "12/8/2022, 5:14:31 PM",
	"dateAddedUTC": "2022-12-08T23:14:31.723Z"
},{
	"index": 1,
	"title": "Library",
	"url": "https://www.uttyler.edu/library/",
	"id": 1052,
	"parentId": "1040",
	"dateAddedLocal": "1/24/2023, 12:24:18 PM",
	"dateAddedUTC": "2023-01-24T18:24:18.570Z"
},{
	"index": 2,
	"title": "UT Tyler Writing Center",
	"url": "https://uttyler.mywconline.com/schedule.php?date=2023-01-24&rschid=sc63b5de11ec7b7",
	"id": 1053,
	"parentId": "1040",
	"dateAddedLocal": "1/24/2023, 5:34:41 PM",
	"dateAddedUTC": "2023-01-24T23:34:41.880Z"
},{
	"index": 3,
	"title": "Students",
	"url": "https://www.uttyler.edu/students/",
	"id": 1059,
	"parentId": "1040",
	"dateAddedLocal": "4/5/2023, 1:57:38 PM",
	"dateAddedUTC": "2023-04-05T18:57:38.883Z"
},{
	"index": 4,
	"title": "UT Tyler Student Counseling Services - Web Component",
	"url": "https://titanium.uttyler.edu/uttscc",
	"id": 1061,
	"parentId": "1040",
	"dateAddedLocal": "5/10/2023, 11:44:34 AM",
	"dateAddedUTC": "2023-05-10T16:44:34.392Z"
},{
	"index": 5,
	"title": "Free APA Citation Generator [Updated for 2023]",
	"url": "https://www.mybib.com/tools/apa-citation-generator",
	"id": 1077,
	"parentId": "1040",
	"dateAddedLocal": "9/18/2023, 4:14:53 PM",
	"dateAddedUTC": "2023-09-18T21:14:53.727Z"
},{
	"index": 6,
	"title": "EV Policy Brief",
	"url": "https://uttyler.instructure.com/courses/41258/assignments/841692?return_to=https%3A%2F%2Futtyler.instructure.com%2Fcalendar%23view_name%3Dmonth%26view_start%3D2024-07-01",
	"id": 1152,
	"parentId": "1040",
	"dateAddedLocal": "6/29/2024, 5:16:53 PM",
	"dateAddedUTC": "2024-06-29T22:16:53.544Z"
},{
	"index": 7,
	"title": "Study Guides - Google Drive",
	"url": "https://drive.google.com/drive/folders/1ZxvjigDiGk9lQx8Wh1f5Mhbnp9LsDN-L",
	"id": 1160,
	"parentId": "1040",
	"dateAddedLocal": "10/10/2024, 1:24:20 PM",
	"dateAddedUTC": "2024-10-10T18:24:20.091Z"
},{
	"index": 8,
	"title": "Exam 2 - Fall 24 - Google Drive",
	"url": "https://drive.google.com/drive/folders/1WiHySZnZgE40XNEpwsRVxkZeXLU3FrBh",
	"id": 1161,
	"parentId": "1040",
	"dateAddedLocal": "10/10/2024, 1:57:25 PM",
	"dateAddedUTC": "2024-10-10T18:57:25.950Z"
},{
	"index": 9,
	"title": "Class",
	"url": "https://drive.google.com/drive/folders/1P0k7AQ3bXN6E343x5p-4iuh8UgN69TRO",
	"id": 1089,
	"parentId": "1040",
	"dateAddedLocal": "11/23/2023, 10:03:38 AM",
	"dateAddedUTC": "2023-11-23T16:03:38.413Z"
},{
	"index": 10,
	"title": "Next",
	"url": "https://wyr.es/next",
	"id": 1165,
	"parentId": "1040",
	"dateAddedLocal": "11/5/2024, 8:44:22 AM",
	"dateAddedUTC": "2024-11-05T14:44:22.009Z"
},{
	"index": 11,
	"title": "LL",
	"url": "https://drive.google.com/drive/folders/1x8I5xqdwrT7OtfSqy-UBPhq_IR4atynq",
	"id": 1154,
	"parentId": "1040",
	"dateAddedLocal": "8/29/2024, 11:33:16 AM",
	"dateAddedUTC": "2024-08-29T16:33:16.327Z"
},{
	"index": 12,
	"title": "chronify",
	"url": "javascript:(function() {    var currentUrl = window.location.href;    var match = currentUrl.match(/\\b\\d{9}\\b/);    if (match) {        var dynamicID = match[0];        var newUrl = 'https://linksaw.com/drchrono/?id=%27%20+%20dynamicID;%20%20%20%20%20%20%20%20window.location.href%20=%20newUrl;%20%20%20%20}})();",
	"id": 1177,
	"parentId": "1040",
	"dateAddedLocal": "1/15/2025, 2:45:36 PM",
	"dateAddedUTC": "2025-01-15T20:45:36.543Z"
},{
	"index": 13,
	"title": "3 tabs",
	"url": "javascript:(function() {var url = window.location.href;var match = url.match(/(\\d+)/);if (match) {var dynamicID = match[1];var notesLink = 'https://sdgrogan.drchrono.com/clinical_note/edit/' + dynamicID + '/all/soap_subjective';var diagnosesLink = 'https://sdgrogan.drchrono.com/clinical_note/edit/' + dynamicID + '/all/soap_assessment';var medsLink = 'https://sdgrogan.drchrono.com/clinical_note/edit/' + dynamicID + '/all/soap_meds_allergies';window.open(medsLink, '_blank');window.open(diagnosesLink, '_blank');window.open(notesLink, '_blank');} else {console.log('No number found in the URL.');}})();",
	"id": 1179,
	"parentId": "1040",
	"dateAddedLocal": "1/15/2025, 4:53:03 PM",
	"dateAddedUTC": "2025-01-15T22:53:03.819Z"
},{
	"index": 7,
	"title": "",
	"url": "http://qk.rs/",
	"id": 1145,
	"parentId": "1",
	"dateAddedLocal": "4/16/2024, 10:04:33 AM",
	"dateAddedUTC": "2024-04-16T15:04:33.315Z"
},{
	"index": 8,
	"title": "",
	"url": "https://uttyler.instructure.com/",
	"id": 1039,
	"parentId": "1",
	"dateAddedLocal": "11/17/2022, 9:53:26 PM",
	"dateAddedUTC": "2022-11-18T03:53:26.016Z"
},{
	"index": 9,
	"title": "",
	"url": "https://calendar.google.com/",
	"id": 1097,
	"parentId": "1",
	"dateAddedLocal": "10/10/2022, 2:40:37 PM",
	"dateAddedUTC": "2022-10-10T19:40:37.068Z"
},{
	"index": 10,
	"title": "Docs",
	"url": "https://docs.google.com/document/u/0/",
	"id": 1108,
	"parentId": "1",
	"dateAddedLocal": "5/25/2023, 8:22:32 AM",
	"dateAddedUTC": "2023-05-25T13:22:32.849Z"
},{
	"index": 11,
	"title": "Blank",
	"url": "https://docs.google.com/document/d/1wHOWvw7w9By_n39SSHUT2RbGpBlbArjMYIEMdwsA1Is/edit",
	"id": 1143,
	"parentId": "1",
	"dateAddedLocal": "3/26/2024, 2:28:37 PM",
	"dateAddedUTC": "2024-03-26T19:28:37.538Z"
},{
	"index": 12,
	"title": "",
	"url": "https://qk.rs/rt/",
	"id": 1147,
	"parentId": "1",
	"dateAddedLocal": "5/16/2024, 3:21:09 PM",
	"dateAddedUTC": "2024-05-16T20:21:09.801Z"
},{
	"index": 13,
	"title": "",
	"url": "https://chat.openai.com/",
	"id": 1129,
	"parentId": "1",
	"dateAddedLocal": "3/4/2024, 7:53:53 PM",
	"dateAddedUTC": "2024-03-05T01:53:53.124Z"
},{
	"index": 14,
	"title": "",
	"url": "https://www.chatgpttextconverter.com/p/chatgpt-text-converter-powered-by-google.html",
	"id": 1158,
	"parentId": "1",
	"dateAddedLocal": "10/3/2024, 11:32:10 AM",
	"dateAddedUTC": "2024-10-03T16:32:10.598Z"
},{
	"index": 15,
	"title": "",
	"url": "https://linksaw.com/",
	"id": 1167,
	"parentId": "1",
	"dateAddedLocal": "11/19/2024, 11:27:32 AM",
	"dateAddedUTC": "2024-11-19T17:27:32.434Z"
},{
	"index": 16,
	"title": "",
	"url": "https://us-uttyler-prod-student.inplacesoftware.com/placement/10797?view=schedule",
	"id": 1182,
	"parentId": "1",
	"dateAddedLocal": "1/16/2025, 8:56:56 AM",
	"dateAddedUTC": "2025-01-16T14:56:56.182Z"
},{
	"index": 17,
	"title": "",
	"url": "https://sdgrogan.drchrono.com/appointments/",
	"id": 1175,
	"parentId": "1",
	"dateAddedLocal": "1/13/2025, 3:05:55 PM",
	"dateAddedUTC": "2025-01-13T21:05:55.202Z"
},{
	"index": 18,
	"title": "",
	"url": "https://raindrop.io/natepuls/links-50593298/search/sort=-created&perpage=30&page=0&search=",
	"id": 1178,
	"parentId": "1",
	"dateAddedLocal": "1/15/2025, 4:12:48 PM",
	"dateAddedUTC": "2025-01-15T22:12:48.991Z"
},{
	"index": 19,
	"title": "",
	"url": "https://discord.com/channels/1037084034284658718/1317697305876627487",
	"id": 1181,
	"parentId": "1",
	"dateAddedLocal": "1/15/2025, 5:18:11 PM",
	"dateAddedUTC": "2025-01-15T23:18:11.026Z"
},{
	"index": 20,
	"title": "3",
	"url": "javascript:(function(){var url=window.location.href;var match=url.match(/(\\d+)/);if(match){var dynamicID=match[1];var notesLink='https://sdgrogan.drchrono.com/clinical_note/edit/'+dynamicID+'/all/soap_subjective';var diagnosesLink='https://sdgrogan.drchrono.com/clinical_note/edit/'+dynamicID+'/all/soap_assessment';var medsLink='https://sdgrogan.drchrono.com/clinical_note/edit/'+dynamicID+'/all/soap_meds_allergies';window.open(medsLink,'_blank');window.open(diagnosesLink,'_blank');window.open(notesLink,'_blank');window.close();}else{console.log('No number found in the URL.');}})();",
	"id": 1180,
	"parentId": "1",
	"dateAddedLocal": "1/15/2025, 5:06:31 PM",
	"dateAddedUTC": "2025-01-15T23:06:31.813Z"
},{
	"index": 21,
	"title": "APEA",
	"url": "https://www.apea.com/account/",
	"id": 1183,
	"parentId": "1",
	"dateAddedLocal": "1/16/2025, 5:43:01 PM",
	"dateAddedUTC": "2025-01-16T23:43:01.310Z"
},{
	"index": 0,
	"title": "Next Batch - Google Drive",
	"url": "https://drive.google.com/drive/folders/0B9enQCxX3s5nYS1ReVotdW9UUzA",
	"id": 616,
	"parentId": "2",
	"dateAddedLocal": "4/4/2017, 12:57:43 PM",
	"dateAddedUTC": "2017-04-04T17:57:43.104Z"
},{
	"index": 1,
	"title": "VoiceRealm",
	"url": "https://www.thevoicerealm.com/",
	"id": 612,
	"parentId": "2",
	"dateAddedLocal": "3/28/2017, 3:54:32 PM",
	"dateAddedUTC": "2017-03-28T20:54:32.459Z"
},{
	"index": 2,
	"title": "Key & Peele - Text Message Confusion - Uncensored - YouTube",
	"url": "https://www.youtube.com/watch?v=naleynXS7yo&list=RDDd7FixvoKBw&index=27",
	"id": 609,
	"parentId": "2",
	"dateAddedLocal": "3/21/2017, 4:03:48 PM",
	"dateAddedUTC": "2017-03-21T21:03:48.081Z"
},{
	"index": 3,
	"title": "Info File",
	"url": "https://docs.google.com/document/d/1r7FCmPyTpD3LCCrX3ub7lAniTXGR0rokSy1qcqT178c/edit",
	"id": 615,
	"parentId": "2",
	"dateAddedLocal": "8/30/2014, 2:08:35 PM",
	"dateAddedUTC": "2014-08-30T19:08:35.936Z"
},{
	"index": 4,
	"title": "Health",
	"url": "https://docs.google.com/document/d/11uaHZr63pK7r1HIsRA15FYZoWcFDJbJ_DsTRDWPiyWw/edit",
	"id": 586,
	"parentId": "2",
	"dateAddedLocal": "8/30/2014, 2:08:13 PM",
	"dateAddedUTC": "2014-08-30T19:08:13.858Z"
},{
	"index": 5,
	"title": "Wages",
	"url": "https://docs.google.com/spreadsheet/ccc?key=0AtenQCxX3s5ndG9JUzFBMlBhN1JhTzh1TEg5YjgyYmc&hl=en_US&pli=1#gid=9",
	"id": 585,
	"parentId": "2",
	"dateAddedLocal": "8/31/2014, 1:11:14 PM",
	"dateAddedUTC": "2014-08-31T18:11:14.284Z"
},{
	"index": 6,
	"title": "EspaÃ±a",
	"url": "https://docs.google.com/document/d/1NorlPC2GTgtGu11wi7HqrqS2cyjc4SaL7byZ_RmPXow/edit",
	"id": 613,
	"parentId": "2",
	"dateAddedLocal": "9/2/2014, 1:06:34 AM",
	"dateAddedUTC": "2014-09-02T06:06:34.845Z"
},{
	"index": 7,
	"title": "DOCUMENTACIÃ“N DE NUEVOS AUXILIARES - Inicio | centro.auxiliares.conversacion | EducaMadrid",
	"url": "http://external.educa2.madrid.org/web/auxiliares/inicio1/-/blogs/documentacion-de-nuevos-auxiliares?_33_redirect=http%3A%2F%2Fexternal.educa2.madrid.org%2Fweb%2Fauxiliares%2Finicio1%3Fp_p_id%3D33%26p_p_lifecycle%3D0%26p_p_state%3Dnormal%26p_p_mode%3Dview%26p_p_col_id%3Dcolumn-1%26p_p_col_count%3D1",
	"id": 589,
	"parentId": "2",
	"dateAddedLocal": "9/27/2014, 12:11:25 PM",
	"dateAddedUTC": "2014-09-27T17:11:25.349Z"
},{
	"index": 8,
	"title": "abundleofjoey on Instagram",
	"url": "http://instagram.com/abundleofjoey",
	"id": 620,
	"parentId": "2",
	"dateAddedLocal": "10/16/2014, 11:28:32 AM",
	"dateAddedUTC": "2014-10-16T16:28:32.552Z"
},{
	"index": 9,
	"title": "JustEat.es",
	"url": "http://www.just-eat.es/area/28015-madrid",
	"id": 611,
	"parentId": "2",
	"dateAddedLocal": "10/15/2014, 10:24:41 AM",
	"dateAddedUTC": "2014-10-15T15:24:41.285Z"
},{
	"index": 10,
	"title": "LingoBongo",
	"url": "http://www.lingobongo.com/madrid/en/",
	"id": 594,
	"parentId": "2",
	"dateAddedLocal": "11/1/2014, 11:06:13 AM",
	"dateAddedUTC": "2014-11-01T16:06:13.156Z"
},{
	"index": 11,
	"title": "ESCUELA OFICIAL DE IDIOMAS",
	"url": "http://eoi.jesusmaestro.madrid.educa.madrid.org//espanolnet.html",
	"id": 607,
	"parentId": "2",
	"dateAddedLocal": "11/15/2014, 8:44:07 AM",
	"dateAddedUTC": "2014-11-15T14:44:07.751Z"
},{
	"index": 12,
	"title": "Best Melodic Dubstep Mix 2014 - YouTube",
	"url": "https://www.youtube.com/watch?v=p6j8fuvQICI",
	"id": 605,
	"parentId": "2",
	"dateAddedLocal": "11/29/2014, 2:28:57 PM",
	"dateAddedUTC": "2014-11-29T20:28:57.007Z"
},{
	"index": 13,
	"title": "Musica",
	"url": "https://www.youtube.com/watch?v=HX9tGiYo39M&feature=youtube_gdata_player&app=desktop",
	"id": 618,
	"parentId": "2",
	"dateAddedLocal": "11/29/2014, 3:26:21 PM",
	"dateAddedUTC": "2014-11-29T21:26:21.226Z"
},{
	"index": 14,
	"title": "OnlineMovies.Pro - Watch Movies Online Free Full HD",
	"url": "http://onlinemovies.pro/",
	"id": 606,
	"parentId": "2",
	"dateAddedLocal": "12/12/2014, 6:06:21 PM",
	"dateAddedUTC": "2014-12-13T00:06:21.781Z"
},{
	"index": 15,
	"title": "Inicio | centro.auxiliares.conversacion | EducaMadrid",
	"url": "http://external.educa2.madrid.org/web/auxiliares/inicio1",
	"id": 592,
	"parentId": "2",
	"dateAddedLocal": "10/6/2014, 12:31:40 PM",
	"dateAddedUTC": "2014-10-06T17:31:40.438Z"
},{
	"index": 16,
	"title": "Peliculas Online ver Estreno de Cine en EspaÃ±ol HD y Gratis",
	"url": "http://pelis24.com/",
	"id": 597,
	"parentId": "2",
	"dateAddedLocal": "1/18/2015, 5:10:00 PM",
	"dateAddedUTC": "2015-01-18T23:10:00.169Z"
},{
	"index": 17,
	"title": "Staggering Beauty",
	"url": "http://www.staggeringbeauty.com/",
	"id": 591,
	"parentId": "2",
	"dateAddedLocal": "1/20/2015, 8:53:54 AM",
	"dateAddedUTC": "2015-01-20T14:53:54.254Z"
},{
	"index": 18,
	"title": "Main Bookmarks",
	"id": 904,
	"parentId": "2",
	"dateAddedLocal": "10/8/2020, 1:51:33 PM",
	"dateAddedUTC": "2020-10-08T18:51:33.498Z"
},{
	"index": 0,
	"title": "",
	"url": "http://www2.fender.com/experience/online-guitar-tuner/",
	"id": 628,
	"parentId": "904",
	"dateAddedLocal": "6/13/2015, 1:51:25 PM",
	"dateAddedUTC": "2015-06-13T18:51:25.549Z"
},{
	"index": 1,
	"title": "sal",
	"url": "https://www.youtube.com/watch?v=4RzhFZmY3Ik&list=PLW7uo9ySXT6REXnAwzCLpDkE0rnd8lfhf",
	"id": 627,
	"parentId": "904",
	"dateAddedLocal": "6/9/2015, 1:09:34 PM",
	"dateAddedUTC": "2015-06-09T18:09:34.885Z"
},{
	"index": 19,
	"title": "voice over referrals",
	"id": 906,
	"parentId": "2",
	"dateAddedLocal": "10/8/2020, 1:51:33 PM",
	"dateAddedUTC": "2020-10-08T18:51:33.498Z"
},{
	"index": 0,
	"title": "Kera O'Bryon: Actress, Singer, Voice Talent: OFFICIAL SITE",
	"url": "http://www.keraobryon.com/",
	"id": 657,
	"parentId": "906",
	"dateAddedLocal": "4/2/2015, 2:35:56 PM",
	"dateAddedUTC": "2015-04-02T19:35:56.955Z"
},{
	"index": 1,
	"title": "Professional Female Voice Over Talent Charlotte, NC",
	"url": "http://www.loudmouthredhead.com/",
	"id": 662,
	"parentId": "906",
	"dateAddedLocal": "4/2/2015, 2:38:01 PM",
	"dateAddedUTC": "2015-04-02T19:38:01.399Z"
},{
	"index": 2,
	"title": "Bev Standing - Voice Talent",
	"url": "http://bevstanding.ca/",
	"id": 656,
	"parentId": "906",
	"dateAddedLocal": "4/2/2015, 2:40:32 PM",
	"dateAddedUTC": "2015-04-02T19:40:32.647Z"
},{
	"index": 3,
	"title": "Moe Rock - Voice Imaging, Production Pro, Voice Talent, Character Voices",
	"url": "http://www.moerock.com/",
	"id": 654,
	"parentId": "906",
	"dateAddedLocal": "4/2/2015, 2:45:05 PM",
	"dateAddedUTC": "2015-04-02T19:45:05.600Z"
},{
	"index": 4,
	"title": "Karyn Oâ€™Bryant | Voice artist. Storyteller.",
	"url": "http://www.karynobryant.com/",
	"id": 659,
	"parentId": "906",
	"dateAddedLocal": "4/3/2015, 3:57:44 AM",
	"dateAddedUTC": "2015-04-03T08:57:44.580Z"
},{
	"index": 5,
	"title": "Heather Costa Voiceover Artist - Professional Sound with a Personal Touch",
	"url": "http://heathercostavo.com/",
	"id": 655,
	"parentId": "906",
	"dateAddedLocal": "4/3/2015, 4:01:40 AM",
	"dateAddedUTC": "2015-04-03T09:01:40.743Z"
},{
	"index": 6,
	"title": "Hello Dolly - Dolly K. Wyatt Voice Over Artist",
	"url": "http://ww.hellodollyvo.com/",
	"id": 652,
	"parentId": "906",
	"dateAddedLocal": "4/3/2015, 4:06:29 AM",
	"dateAddedUTC": "2015-04-03T09:06:29.007Z"
},{
	"index": 7,
	"title": "Karen Joyce - Home",
	"url": "http://karen-joyce.com/",
	"id": 661,
	"parentId": "906",
	"dateAddedLocal": "4/3/2015, 4:08:59 AM",
	"dateAddedUTC": "2015-04-03T09:08:59.566Z"
},{
	"index": 8,
	"title": "Katie Dehnart | Professional Voiceover | Specializing in Cartoon Characters, Audio Books and Radio Commercials",
	"url": "http://www.voiceofkatie.com/",
	"id": 660,
	"parentId": "906",
	"dateAddedLocal": "4/3/2015, 4:11:28 AM",
	"dateAddedUTC": "2015-04-03T09:11:28.778Z"
},{
	"index": 9,
	"title": "Martha Kahn - San Diego Female Voice Actor - San Diego Voice Over",
	"url": "http://marthakahn.com/",
	"id": 651,
	"parentId": "906",
	"dateAddedLocal": "4/6/2015, 8:33:28 AM",
	"dateAddedUTC": "2015-04-06T13:33:28.223Z"
},{
	"index": 10,
	"title": "Christi Bowen",
	"url": "http://www.christibowen.com/",
	"id": 653,
	"parentId": "906",
	"dateAddedLocal": "4/6/2015, 8:51:46 AM",
	"dateAddedUTC": "2015-04-06T13:51:46.770Z"
},{
	"index": 11,
	"title": "Trish Basanyi â€“ Professional Female Voice Talent Voiceovers by Trish | Female Voiceover Talent | Trish Basanyi",
	"url": "http://voiceoversbytrish.com/",
	"id": 658,
	"parentId": "906",
	"dateAddedLocal": "4/20/2015, 5:08:19 AM",
	"dateAddedUTC": "2015-04-20T10:08:19.425Z"
},{
	"index": 20,
	"title": "Rona MacGregorâ€™s stream on SoundCloud - Listen to music",
	"url": "https://soundcloud.com/rona-macgregor",
	"id": 593,
	"parentId": "2",
	"dateAddedLocal": "4/12/2015, 1:22:07 PM",
	"dateAddedUTC": "2015-04-12T18:22:07.715Z"
},{
	"index": 21,
	"title": "important meow",
	"id": 905,
	"parentId": "2",
	"dateAddedLocal": "10/8/2020, 1:51:33 PM",
	"dateAddedUTC": "2020-10-08T18:51:33.498Z"
},{
	"index": 0,
	"title": "Â· Ministerio de PolÃ­tica Territorial y AdministraciÃ³n PÃºblica Â·",
	"url": "https://sede.administracionespublicas.gob.es/icpplus/citar",
	"id": 626,
	"parentId": "905",
	"dateAddedLocal": "6/7/2015, 12:28:33 PM",
	"dateAddedUTC": "2015-06-07T17:28:33.082Z"
},{
	"index": 1,
	"title": "http://www.educa2.madrid.org/web/educamadrid/principal/files/b205a2ee-682c-41da-b886-376593c987b9/Tr%C3%A1mites%20renovaci%C3%B3n_mayo2014.pdf",
	"url": "http://www.educa2.madrid.org/web/educamadrid/principal/files/b205a2ee-682c-41da-b886-376593c987b9/Tr%C3%A1mites%20renovaci%C3%B3n_mayo2014.pdf",
	"id": 623,
	"parentId": "905",
	"dateAddedLocal": "6/7/2015, 12:34:09 PM",
	"dateAddedUTC": "2015-06-07T17:34:09.444Z"
},{
	"index": 2,
	"title": ":: ExtranjerÃ­a :: Ministerio de Hacienda y Administraciones PÃºblicas ::",
	"url": "https://sede.administracionespublicas.gob.es/infoext2/",
	"id": 625,
	"parentId": "905",
	"dateAddedLocal": "6/7/2015, 1:13:28 PM",
	"dateAddedUTC": "2015-06-07T18:13:28.670Z"
},{
	"index": 3,
	"title": "Life After College: Renewing Your TIE in Madrid",
	"url": "http://lifeaftercollegelvt.blogspot.com.es/2014/05/renewing-your-tie-in-madrid.html",
	"id": 624,
	"parentId": "905",
	"dateAddedLocal": "6/7/2015, 2:00:56 PM",
	"dateAddedUTC": "2015-06-07T19:00:56.026Z"
},{
	"index": 22,
	"title": "",
	"url": "http://www.listentoyoutube.com/",
	"id": 619,
	"parentId": "2",
	"dateAddedLocal": "1/18/2015, 11:45:24 AM",
	"dateAddedUTC": "2015-01-18T17:45:24.628Z"
},{
	"index": 23,
	"title": "Spotify",
	"url": "https://play.spotify.com/collection/artists",
	"id": 595,
	"parentId": "2",
	"dateAddedLocal": "11/29/2014, 11:52:22 AM",
	"dateAddedUTC": "2014-11-29T17:52:22.529Z"
},{
	"index": 24,
	"title": "",
	"url": "http://www.youtube-mp3.org/",
	"id": 600,
	"parentId": "2",
	"dateAddedLocal": "1/18/2015, 11:50:01 AM",
	"dateAddedUTC": "2015-01-18T17:50:01.555Z"
},{
	"index": 25,
	"title": "",
	"url": "http://www.zenpen.io/",
	"id": 604,
	"parentId": "2",
	"dateAddedLocal": "7/21/2015, 1:26:26 PM",
	"dateAddedUTC": "2015-07-21T18:26:26.117Z"
},{
	"index": 26,
	"title": "current",
	"id": 760,
	"parentId": "2",
	"dateAddedLocal": "10/8/2020, 1:47:44 PM",
	"dateAddedUTC": "2020-10-08T18:47:44.128Z"
},{
	"index": 27,
	"title": "QR Code Generator â€“ create QR codes for free (Logo, T-Shirt, vCard, EPS)",
	"url": "http://goqr.me/#",
	"id": 621,
	"parentId": "2",
	"dateAddedLocal": "5/30/2016, 12:45:37 PM",
	"dateAddedUTC": "2016-05-30T17:45:37.189Z"
},{
	"index": 28,
	"title": "Start",
	"url": "https://uxmag.com/articles/so-you-want-to-be-a-designer-top-5-list",
	"id": 602,
	"parentId": "2",
	"dateAddedLocal": "8/16/2016, 2:39:08 PM",
	"dateAddedUTC": "2016-08-16T19:39:08.765Z"
},{
	"index": 29,
	"title": "UX Class",
	"url": "https://www.springboard.com/learning-paths/user-experience-design/learn/",
	"id": 610,
	"parentId": "2",
	"dateAddedLocal": "8/16/2016, 2:23:30 PM",
	"dateAddedUTC": "2016-08-16T19:23:30.317Z"
},{
	"index": 30,
	"title": "Random",
	"id": 757,
	"parentId": "2",
	"dateAddedLocal": "10/8/2020, 1:47:44 PM",
	"dateAddedUTC": "2020-10-08T18:47:44.127Z"
},{
	"index": 0,
	"title": "Zip Codes",
	"url": "https://www.randomlists.com/random-zip-codes",
	"id": 639,
	"parentId": "757",
	"dateAddedLocal": "7/14/2016, 5:57:19 PM",
	"dateAddedUTC": "2016-07-14T22:57:19.992Z"
},{
	"index": 1,
	"title": "Jobs",
	"url": "https://www.randomlists.com/random-jobs",
	"id": 632,
	"parentId": "757",
	"dateAddedLocal": "7/14/2016, 5:57:56 PM",
	"dateAddedUTC": "2016-07-14T22:57:56.962Z"
},{
	"index": 2,
	"title": "Optica Tips",
	"url": "http://optica-tests.tumblr.com/",
	"id": 637,
	"parentId": "757",
	"dateAddedLocal": "8/3/2016, 4:55:31 PM",
	"dateAddedUTC": "2016-08-03T21:55:31.751Z"
},{
	"index": 3,
	"title": "Amazon.com Help: Send Documents and Web Pages to Your Kindle",
	"url": "https://www.amazon.com/gp/help/customer/display.html?nodeId=201238330",
	"id": 640,
	"parentId": "757",
	"dateAddedLocal": "8/4/2016, 2:49:48 PM",
	"dateAddedUTC": "2016-08-04T19:49:48.464Z"
},{
	"index": 4,
	"title": "UXmatters :: Top Articles",
	"url": "http://www.uxmatters.com/top-articles.php",
	"id": 635,
	"parentId": "757",
	"dateAddedLocal": "8/4/2016, 3:08:50 PM",
	"dateAddedUTC": "2016-08-04T20:08:50.433Z"
},{
	"index": 5,
	"title": "My Advice for Becoming a UX Designer",
	"url": "http://jessicaivins.net/my-advice-for-becoming-a-ux-designer/",
	"id": 634,
	"parentId": "757",
	"dateAddedLocal": "8/4/2016, 3:09:27 PM",
	"dateAddedUTC": "2016-08-04T20:09:27.335Z"
},{
	"index": 6,
	"title": "Boxes and Arrows",
	"url": "http://boxesandarrows.com/",
	"id": 633,
	"parentId": "757",
	"dateAddedLocal": "8/4/2016, 3:10:17 PM",
	"dateAddedUTC": "2016-08-04T20:10:17.786Z"
},{
	"index": 7,
	"title": "A List Apart: For People Who Make Websites",
	"url": "http://alistapart.com/",
	"id": 636,
	"parentId": "757",
	"dateAddedLocal": "8/4/2016, 3:11:07 PM",
	"dateAddedUTC": "2016-08-04T20:11:07.751Z"
},{
	"index": 8,
	"title": "*Interaction Design Foundation: a global UX learning community | Interaction Design Foundation",
	"url": "https://www.interaction-design.org/",
	"id": 638,
	"parentId": "757",
	"dateAddedLocal": "8/5/2016, 9:40:45 PM",
	"dateAddedUTC": "2016-08-06T02:40:45.602Z"
},{
	"index": 9,
	"title": "*Read It: Search User Interfaces",
	"url": "http://searchuserinterfaces.com/book/",
	"id": 641,
	"parentId": "757",
	"dateAddedLocal": "8/6/2016, 7:25:00 PM",
	"dateAddedUTC": "2016-08-07T00:25:00.080Z"
},{
	"index": 31,
	"title": "+",
	"id": 759,
	"parentId": "2",
	"dateAddedLocal": "10/8/2020, 1:47:44 PM",
	"dateAddedUTC": "2020-10-08T18:47:44.128Z"
},{
	"index": 0,
	"title": "Inbox",
	"url": "https://inbox.google.com/u/0/",
	"id": 647,
	"parentId": "759",
	"dateAddedLocal": "5/29/2016, 5:31:27 PM",
	"dateAddedUTC": "2016-05-29T22:31:27.561Z"
},{
	"index": 1,
	"title": "Info File - Google Sheets",
	"url": "https://docs.google.com/spreadsheets/d/11FBb2_jsZozsA49LaQHTNGcH5gvLBAmNf2e8U2CPSkY/edit",
	"id": 646,
	"parentId": "759",
	"dateAddedLocal": "6/13/2016, 12:14:00 PM",
	"dateAddedUTC": "2016-06-13T17:14:00.749Z"
},{
	"index": 2,
	"title": "New Story",
	"url": "https://medium.com/new-story",
	"id": 648,
	"parentId": "759",
	"dateAddedLocal": "6/16/2016, 10:12:44 AM",
	"dateAddedUTC": "2016-06-16T15:12:44.912Z"
},{
	"index": 3,
	"title": "FB Messages",
	"url": "https://www.facebook.com/messages",
	"id": 645,
	"parentId": "759",
	"dateAddedLocal": "7/8/2016, 5:03:16 PM",
	"dateAddedUTC": "2016-07-08T22:03:16.524Z"
},{
	"index": 32,
	"title": "shrib",
	"url": "https://secure.shrib.com/nathanpuls",
	"id": 601,
	"parentId": "2",
	"dateAddedLocal": "9/13/2016, 12:46:44 PM",
	"dateAddedUTC": "2016-09-13T17:46:44.960Z"
},{
	"index": 33,
	"title": "Malas Madres PelÃ­cula Completa EspaÃ±ol Latino HD - YouTube",
	"url": "https://www.youtube.com/watch?v=zeRm0QJECUI",
	"id": 584,
	"parentId": "2",
	"dateAddedLocal": "2/7/2017, 8:07:47 AM",
	"dateAddedUTC": "2017-02-07T14:07:47.459Z"
},{
	"index": 34,
	"title": "animation studios in houston - Google Search",
	"url": "https://www.google.com/webhp?sourceid=chrome-instant&ion=1&espv=2&ie=UTF-8#q=animation+studios+in+houston",
	"id": 587,
	"parentId": "2",
	"dateAddedLocal": "2/7/2017, 3:57:14 PM",
	"dateAddedUTC": "2017-02-07T21:57:14.158Z"
},{
	"index": 35,
	"title": "Voice Talent/Voice Overs - Talent - Houston Production Guide",
	"url": "http://www.houstonproductionguide.com/talent/voice-talentvoice-overs/",
	"id": 608,
	"parentId": "2",
	"dateAddedLocal": "2/7/2017, 3:58:26 PM",
	"dateAddedUTC": "2017-02-07T21:58:26.108Z"
},{
	"index": 36,
	"title": "This Is Us Season 1 Episode 1 Pilot | Watch Tv Series Live, Watch Tv Series Tv Shows",
	"url": "http://ww1.watchtvserieslive.org/this-is-us-season-1-episode-1-pilot/",
	"id": 596,
	"parentId": "2",
	"dateAddedLocal": "2/19/2017, 7:52:21 PM",
	"dateAddedUTC": "2017-02-20T01:52:21.212Z"
},{
	"index": 37,
	"title": "All Our Improv Games",
	"url": "https://docs.google.com/document/d/1jLyJ2OJ-b6LvTuQdhn9hpC87SDylaZKnz7j7Pg-n3Sc/edit",
	"id": 588,
	"parentId": "2",
	"dateAddedLocal": "11/29/2016, 10:20:11 PM",
	"dateAddedUTC": "2016-11-30T04:20:11.774Z"
},{
	"index": 38,
	"title": "This Is Us | Watch Tv Series Live, Watch Tv Series Tv Shows",
	"url": "http://ww1.watchtvserieslive.org/tvseries/this-is-us/",
	"id": 617,
	"parentId": "2",
	"dateAddedLocal": "2/27/2017, 6:53:53 PM",
	"dateAddedUTC": "2017-02-28T00:53:53.813Z"
},{
	"index": 39,
	"title": "Housing",
	"id": 765,
	"parentId": "2",
	"dateAddedLocal": "10/8/2020, 1:47:44 PM",
	"dateAddedUTC": "2020-10-08T18:47:44.128Z"
},{
	"index": 0,
	"title": "The City - Seeking Male roommate for a HUGE shared bedroom in 5 bedroom/3 bath house in West LA - $625.00 per month",
	"url": "https://realityla.onthecity.org/marketplace_listings/223550",
	"id": 903,
	"parentId": "765",
	"dateAddedLocal": "1/18/2017, 5:35:17 PM",
	"dateAddedUTC": "2017-01-18T23:35:17.593Z"
},{
	"index": 40,
	"title": "Music",
	"id": 758,
	"parentId": "2",
	"dateAddedLocal": "10/8/2020, 1:47:44 PM",
	"dateAddedUTC": "2020-10-08T18:47:44.127Z"
},{
	"index": 0,
	"title": "Epic Chillstep Collection 2015 [2 Hours] - YouTube",
	"url": "https://www.youtube.com/watch?v=fWRISvgAygU&spfreload=5",
	"id": 893,
	"parentId": "758",
	"dateAddedLocal": "3/1/2017, 7:23:08 PM",
	"dateAddedUTC": "2017-03-02T01:23:08.287Z"
},{
	"index": 1,
	"title": "Best of Hans Zimmer - All time greatest soundtracks! - YouTube",
	"url": "https://www.youtube.com/watch?v=cdgUhz2F0Mg",
	"id": 894,
	"parentId": "758",
	"dateAddedLocal": "3/1/2017, 7:43:57 PM",
	"dateAddedUTC": "2017-03-02T01:43:57.046Z"
},{
	"index": 2,
	"title": "I Need You More - Jesus Culture With Bethel Music - Legendado em InglÃªs PortuguÃªs - YouTube",
	"url": "https://www.youtube.com/watch?v=AVlvzBY1SiI",
	"id": 892,
	"parentId": "758",
	"dateAddedLocal": "10/29/2016, 7:04:11 AM",
	"dateAddedUTC": "2016-10-29T12:04:11.181Z"
},{
	"index": 41,
	"title": "Strings & Console Output | Codecademy",
	"url": "https://www.codecademy.com/courses/python-beginner-sRXwR/2/2?curriculum_id=4f89dab3d788890003000096",
	"id": 598,
	"parentId": "2",
	"dateAddedLocal": "3/30/2017, 8:10:22 PM",
	"dateAddedUTC": "2017-03-31T01:10:22.998Z"
},{
	"index": 42,
	"title": "Members",
	"url": "https://mychristiancare.org/members/",
	"id": 599,
	"parentId": "2",
	"dateAddedLocal": "3/20/2018, 7:24:22 PM",
	"dateAddedUTC": "2018-03-21T00:24:22.979Z"
},{
	"index": 43,
	"title": "This Life is Crazy",
	"url": "https://www.lucidchart.com/documents#docs?folder_id=home&browser=icon&sort=saved-desc",
	"id": 614,
	"parentId": "2",
	"dateAddedLocal": "7/12/2018, 3:45:33 PM",
	"dateAddedUTC": "2018-07-12T20:45:33.723Z"
},{
	"index": 44,
	"title": "Half-Marathon Training Schedule for Beginners",
	"url": "https://www.verywellfit.com/half-marathon-training-schedule-for-beginners-2911618",
	"id": 603,
	"parentId": "2",
	"dateAddedLocal": "7/30/2018, 7:08:08 PM",
	"dateAddedUTC": "2018-07-31T00:08:08.188Z"
},{
	"index": 45,
	"title": "Settings - Sound",
	"url": "chrome://settings/content/sound",
	"id": 590,
	"parentId": "2",
	"dateAddedLocal": "11/30/2019, 1:08:49 PM",
	"dateAddedUTC": "2019-11-30T19:08:49.721Z"
},{
	"index": 46,
	"title": "ðŸ”»SCHOOL",
	"id": 735,
	"parentId": "2",
	"dateAddedLocal": "6/11/2020, 6:06:20 PM",
	"dateAddedUTC": "2020-06-11T23:06:20.670Z"
},{
	"index": 0,
	"title": "UWorld",
	"url": "https://www.uworld.com/ClientApp/V2/apps/Qbank/index.html#/test/createtest/5916945",
	"id": 509,
	"parentId": "735",
	"dateAddedLocal": "3/2/2020, 4:57:08 PM",
	"dateAddedUTC": "2020-03-02T22:57:08.597Z"
},{
	"index": 1,
	"title": "Evolve",
	"url": "https://evolve.elsevier.com/Resources/157231_global_0001",
	"id": 525,
	"parentId": "735",
	"dateAddedLocal": "2/1/2020, 3:03:23 PM",
	"dateAddedUTC": "2020-02-01T21:03:23.477Z"
},{
	"index": 2,
	"title": "MY S2 Checklist - Nathan Puls - Google Sheets",
	"url": "https://docs.google.com/spreadsheets/d/1A9TPR5vrvno4IJ0RJ7MJNhs6JEU3ukF3RfEoBoQBVt0/edit?usp=sharing",
	"id": 508,
	"parentId": "735",
	"dateAddedLocal": "1/9/2020, 7:48:59 PM",
	"dateAddedUTC": "2020-01-10T01:48:59.247Z"
},{
	"index": 3,
	"title": "Mail",
	"url": "https://webmail.uth.tmc.edu/owa/?bO=1#path=/mail",
	"id": 515,
	"parentId": "735",
	"dateAddedLocal": "3/15/2019, 6:40:40 PM",
	"dateAddedUTC": "2019-03-15T23:40:40.806Z"
},{
	"index": 4,
	"title": "Canvas",
	"url": "https://uth.instructure.com/",
	"id": 529,
	"parentId": "735",
	"dateAddedLocal": "3/15/2019, 6:38:13 PM",
	"dateAddedUTC": "2019-03-15T23:38:13.896Z"
},{
	"index": 5,
	"title": "Facebook Page",
	"url": "https://www.facebook.com/groups/482436258933602/",
	"id": 528,
	"parentId": "735",
	"dateAddedLocal": "8/19/2019, 5:52:15 PM",
	"dateAddedUTC": "2019-08-19T22:52:15.730Z"
},{
	"index": 6,
	"title": "OB Clinical Online - Google Docs",
	"url": "https://docs.google.com/document/d/1w7z6_1Tz9c4bfa4y4kOFWn59Na_xtyA5ivFCvZncuGM/edit",
	"id": 531,
	"parentId": "735",
	"dateAddedLocal": "3/23/2020, 11:11:05 AM",
	"dateAddedUTC": "2020-03-23T16:11:05.056Z"
},{
	"index": 7,
	"title": "Group 2: Group 2: 2201NURS3532B100",
	"url": "https://uth.instructure.com/courses/48949/groups/22182",
	"id": 534,
	"parentId": "735",
	"dateAddedLocal": "3/18/2020, 12:58:06 PM",
	"dateAddedUTC": "2020-03-18T17:58:06.927Z"
},{
	"index": 8,
	"title": "Messages",
	"url": "https://www.facebook.com/messages",
	"id": 523,
	"parentId": "735",
	"dateAddedLocal": "9/7/2019, 8:12:29 PM",
	"dateAddedUTC": "2019-09-08T01:12:29.432Z"
},{
	"index": 9,
	"title": "Alief Clinical Group w/cg",
	"url": "https://uth.instructure.com/groups/18762/discussion_topics",
	"id": 530,
	"parentId": "735",
	"dateAddedLocal": "8/27/2019, 9:05:03 AM",
	"dateAddedUTC": "2019-08-27T14:05:03.940Z"
},{
	"index": 10,
	"title": "S1",
	"id": 761,
	"parentId": "735",
	"dateAddedLocal": "10/8/2020, 1:47:44 PM",
	"dateAddedUTC": "2020-10-08T18:47:44.128Z"
},{
	"index": 0,
	"title": "Done",
	"id": 762,
	"parentId": "761",
	"dateAddedLocal": "10/8/2020, 1:47:44 PM",
	"dateAddedUTC": "2020-10-08T18:47:44.128Z"
},{
	"index": 0,
	"title": "Community HESI case studies",
	"id": 763,
	"parentId": "762",
	"dateAddedLocal": "10/8/2020, 1:47:44 PM",
	"dateAddedUTC": "2020-10-08T18:47:44.128Z"
},{
	"index": 0,
	"title": "Part 1: Bioterrorism case study Flashcards | Quizlet",
	"url": "https://quizlet.com/264697218/bioterrorism-case-study-flash-cards/",
	"id": 901,
	"parentId": "763",
	"dateAddedLocal": "9/7/2019, 6:37:57 PM",
	"dateAddedUTC": "2019-09-07T23:37:57.809Z"
},{
	"index": 1,
	"title": "Part 2: HESI Bioterrorism Flashcards | Quizlet",
	"url": "https://quizlet.com/303945387/hesi-bioterrorism-flash-cards/",
	"id": 896,
	"parentId": "763",
	"dateAddedLocal": "9/7/2019, 6:42:26 PM",
	"dateAddedUTC": "2019-09-07T23:42:26.347Z"
},{
	"index": 2,
	"title": "Gonorrhea HESI Case Study Flashcards | Quizlet",
	"url": "https://quizlet.com/335668090/gonorrhea-hesi-case-study-flash-cards/",
	"id": 899,
	"parentId": "763",
	"dateAddedLocal": "9/7/2019, 6:54:00 PM",
	"dateAddedUTC": "2019-09-07T23:54:00.353Z"
},{
	"index": 3,
	"title": "Part 1: HESI Case Study- Herpes Simplex Virus (HSV) Flashcards | Quizlet",
	"url": "https://quizlet.com/214274748/hesi-case-study-herpes-simplex-virus-hsv-flash-cards/",
	"id": 902,
	"parentId": "763",
	"dateAddedLocal": "9/7/2019, 6:57:48 PM",
	"dateAddedUTC": "2019-09-07T23:57:48.050Z"
},{
	"index": 4,
	"title": "Part 2: Herpes Simplex Virus (HSV) Flashcards | Quizlet",
	"url": "https://quizlet.com/329299212/herpes-simplex-virus-hsv-flash-cards/",
	"id": 897,
	"parentId": "763",
	"dateAddedLocal": "9/7/2019, 7:01:23 PM",
	"dateAddedUTC": "2019-09-08T00:01:23.369Z"
},{
	"index": 5,
	"title": "Natural Disaster in a Small Community Flashcards | Quizlet",
	"url": "https://quizlet.com/267102059/community-health-natural-disaster-in-a-small-community-flash-cards/",
	"id": 898,
	"parentId": "763",
	"dateAddedLocal": "9/7/2019, 7:40:01 PM",
	"dateAddedUTC": "2019-09-08T00:40:01.057Z"
},{
	"index": 6,
	"title": "Hospice",
	"url": "https://photos.google.com/share/AF1QipMdQwwdqITcYLhfYInh3vPGTBvahbOJFbe-iiKsZ4IhesG4jnnqAeEz4cUHErN_lQ?key=TXUwYUZIZTVLcDhWM1JPeEVEWnE5RFZxMkRHTTl3",
	"id": 900,
	"parentId": "763",
	"dateAddedLocal": "9/8/2019, 9:14:41 AM",
	"dateAddedUTC": "2019-09-08T14:14:41.798Z"
},{
	"index": 1,
	"title": "vSim",
	"url": "http://thepoint.lww.com/Book/Show/504002?focus=vs#/CoursePointContent/Show/18660d4b-1a94-4fef-8b55-38db00955d9a?forceView=False&viewMode=Student&productAssetId=18660d4b-1a94-4fef-8b55-38db00955d9a&behavior=Display&groupby=learningactivity&ts=1566517118120",
	"id": 895,
	"parentId": "762",
	"dateAddedLocal": "8/22/2019, 6:38:45 PM",
	"dateAddedUTC": "2019-08-22T23:38:45.622Z"
},{
	"index": 1,
	"title": "Wongs TB",
	"url": "http://testbankgo.eu/wongs-nursing-care-of-infants-and-children-10e/",
	"id": 665,
	"parentId": "761",
	"dateAddedLocal": "9/3/2019, 9:29:19 PM",
	"dateAddedUTC": "2019-09-04T02:29:19.932Z"
},{
	"index": 2,
	"title": "S1 Semester Checklist and Due Dates - Google Docs",
	"url": "https://docs.google.com/document/d/1RvaWXvXEM_R6sT5fRGK3orOOSFHkUyHrWXon7Wibo9s/edit",
	"id": 668,
	"parentId": "761",
	"dateAddedLocal": "9/5/2019, 4:02:35 PM",
	"dateAddedUTC": "2019-09-05T21:02:35.747Z"
},{
	"index": 3,
	"title": "Peds Group 8 - Juvenile Idiopathic Arthritis - Google Docs",
	"url": "https://docs.google.com/document/d/1fPfCav44cfy4gLe4jtywdpxazU3wI90Dc3Cg1VQ-MSo/edit",
	"id": 669,
	"parentId": "761",
	"dateAddedLocal": "9/5/2019, 4:01:01 PM",
	"dateAddedUTC": "2019-09-05T21:01:01.365Z"
},{
	"index": 4,
	"title": "Peds Group 8 - Age Group: Adolescent Topic: Juvenile idiopathic arthritis: Developmental Group 8 - Age Group: Adolescent Topic: Juvenile idiopathic arthritis: 2193NURS3536-100",
	"url": "https://uth.instructure.com/groups/18858",
	"id": 664,
	"parentId": "761",
	"dateAddedLocal": "9/12/2019, 11:40:40 AM",
	"dateAddedUTC": "2019-09-12T16:40:40.700Z"
},{
	"index": 5,
	"title": "HA Skills Lab 2",
	"url": "https://uth.instructure.com/courses/46218/pages/clinical-skills-lab-number-2-fri-sept-13-or-sept-20-as-scheduled?module_item_id=503960",
	"id": 667,
	"parentId": "761",
	"dateAddedLocal": "9/12/2019, 11:49:51 AM",
	"dateAddedUTC": "2019-09-12T16:49:51.193Z"
},{
	"index": 6,
	"title": "Peds E2 Practice Questions - Google Docs",
	"url": "https://docs.google.com/document/d/1xYf5tnOEutyracrAVjmE6tYy6qVRANxgiRU-wxofMQw/edit",
	"id": 666,
	"parentId": "761",
	"dateAddedLocal": "9/16/2019, 9:13:42 PM",
	"dateAddedUTC": "2019-09-17T02:13:42.805Z"
},{
	"index": 7,
	"title": "TB",
	"url": "http://testbankgo.eu/",
	"id": 670,
	"parentId": "761",
	"dateAddedLocal": "9/22/2019, 2:54:46 PM",
	"dateAddedUTC": "2019-09-22T19:54:46.127Z"
},{
	"index": 11,
	"title": "pCloud :: File Manager",
	"url": "https://my.pcloud.com/?label=Shared%20folder%20request#page=filemanager&folder=4375220045",
	"id": 521,
	"parentId": "735",
	"dateAddedLocal": "10/31/2019, 2:30:29 PM",
	"dateAddedUTC": "2019-10-31T19:30:29.911Z"
},{
	"index": 12,
	"title": "GroupMe",
	"url": "https://web.groupme.com/chats",
	"id": 533,
	"parentId": "735",
	"dateAddedLocal": "11/1/2019, 11:55:48 PM",
	"dateAddedUTC": "2019-11-02T04:55:48.792Z"
},{
	"index": 13,
	"title": "PSA Script 2 - Director's Cut - Google Docs",
	"url": "https://docs.google.com/document/d/1BRPh-zqqZnxpZLKRiYwyaIlvp_SaVE07v1O4BFHlNK0/edit",
	"id": 512,
	"parentId": "735",
	"dateAddedLocal": "11/23/2019, 5:57:49 PM",
	"dateAddedUTC": "2019-11-23T23:57:49.426Z"
},{
	"index": 14,
	"title": "Bullying PSA - YouTube",
	"url": "https://www.youtube.com/watch?v=spEkEkoaMgc&feature=youtu.be",
	"id": 507,
	"parentId": "735",
	"dateAddedLocal": "11/23/2019, 5:57:54 PM",
	"dateAddedUTC": "2019-11-23T23:57:54.795Z"
},{
	"index": 15,
	"title": "S2 Checklist - Shareable - Click: File > Make a copy - Google Sheets",
	"url": "https://docs.google.com/spreadsheets/d/1QKkESDc-ETM8qIdP_ZOdCNKm9RGtza_LHldUxndt8ow/edit#gid=0",
	"id": 520,
	"parentId": "735",
	"dateAddedLocal": "1/9/2020, 7:48:35 PM",
	"dateAddedUTC": "2020-01-10T01:48:35.109Z"
},{
	"index": 16,
	"title": "Res-Significance of Research in Nursing: Research Critique & Utilization (2201NURS4512W100)",
	"url": "https://uth.instructure.com/courses/48912/pages/significance-of-research-in-nursing?module_item_id=552023",
	"id": 513,
	"parentId": "735",
	"dateAddedLocal": "1/12/2020, 11:06:34 PM",
	"dateAddedUTC": "2020-01-13T05:06:34.229Z"
},{
	"index": 17,
	"title": "Clinical Refelction 1",
	"url": "https://uth.instructure.com/courses/48945/assignments/130567",
	"id": 505,
	"parentId": "735",
	"dateAddedLocal": "1/15/2020, 1:59:49 PM",
	"dateAddedUTC": "2020-01-15T19:59:49.414Z"
},{
	"index": 18,
	"title": "Research",
	"id": 764,
	"parentId": "735",
	"dateAddedLocal": "10/8/2020, 1:47:44 PM",
	"dateAddedUTC": "2020-10-08T18:47:44.128Z"
},{
	"index": 0,
	"title": "Databases",
	"url": "https://uth.instructure.com/courses/48912/assignments/134606",
	"id": 720,
	"parentId": "764",
	"dateAddedLocal": "1/15/2020, 2:48:08 PM",
	"dateAddedUTC": "2020-01-15T20:48:08.585Z"
},{
	"index": 19,
	"title": "Student Schedules-Preceptor Groups ONLY - Google Sheets",
	"url": "https://docs.google.com/spreadsheets/d/14Nej4ae7Xe0Z0aWxNT-3lSvDYHW18kzGucpVjKOpeBQ/edit#gid=0",
	"id": 519,
	"parentId": "735",
	"dateAddedLocal": "2/1/2020, 2:19:59 PM",
	"dateAddedUTC": "2020-02-01T20:19:59.628Z"
},{
	"index": 20,
	"title": "Recruitment",
	"url": "https://workforcenow.adp.com/mascsr/default/mdf/recruitment/recruitment.html?lang=en_US&cid=4847f7f7-e646-494e-a39a-b5f63c12d8f9&ccId=19000101_000001",
	"id": 518,
	"parentId": "735",
	"dateAddedLocal": "2/7/2020, 2:22:53 PM",
	"dateAddedUTC": "2020-02-07T20:22:53.236Z"
},{
	"index": 21,
	"title": "How to Write a Letter of Interest for a Job (Sample & 20+ Tips)",
	"url": "https://zety.com/blog/letter-of-interest",
	"id": 517,
	"parentId": "735",
	"dateAddedLocal": "2/8/2020, 2:17:51 PM",
	"dateAddedUTC": "2020-02-08T20:17:51.839Z"
},{
	"index": 22,
	"title": "Letter of Interest - Google Docs",
	"url": "https://docs.google.com/document/d/1Sp8rIhjCPO3tUIcszWXtuNYH71z-XEMKTO-Yt9R71Jo/edit",
	"id": 511,
	"parentId": "735",
	"dateAddedLocal": "2/8/2020, 4:32:19 PM",
	"dateAddedUTC": "2020-02-08T22:32:19.969Z"
},{
	"index": 23,
	"title": "Staff Nurse I, HCPC Acuity Management",
	"url": "https://uth.taleo.net/careersection/ex/jobdetail.ftl",
	"id": 527,
	"parentId": "735",
	"dateAddedLocal": "3/6/2020, 9:31:52 PM",
	"dateAddedUTC": "2020-03-07T03:31:52.223Z"
},{
	"index": 24,
	"title": "OB Clin Group 1: Group 1: 2201NURS3532B100",
	"url": "https://uth.instructure.com/courses/48949/groups/22181",
	"id": 532,
	"parentId": "735",
	"dateAddedLocal": "3/24/2020, 5:49:44 PM",
	"dateAddedUTC": "2020-03-24T22:49:44.854Z"
},{
	"index": 25,
	"title": "Peds SIMS",
	"url": "https://evolve.elsevier.com/Courses/154359_unursing8_1005#/folder/21141213126",
	"id": 506,
	"parentId": "735",
	"dateAddedLocal": "3/27/2020, 2:56:43 PM",
	"dateAddedUTC": "2020-03-27T19:56:43.259Z"
},{
	"index": 26,
	"title": "ClinicalKey - Lead with Answers",
	"url": "https://www.clinicalkey.com/nursing/#!/",
	"id": 514,
	"parentId": "735",
	"dateAddedLocal": "3/28/2020, 3:14:47 PM",
	"dateAddedUTC": "2020-03-28T20:14:47.737Z"
},{
	"index": 27,
	"title": "Pedi SLS-1 - Google Docs",
	"url": "https://docs.google.com/document/d/1JrGAkG0pWjOogmTz98EHZgHEq4NeLW7opsghp0tC7Lk/edit?ts=5e7fb6de",
	"id": 510,
	"parentId": "735",
	"dateAddedLocal": "3/28/2020, 4:23:59 PM",
	"dateAddedUTC": "2020-03-28T21:23:59.742Z"
},{
	"index": 28,
	"title": "Pedi SLS 10 - Google Docs",
	"url": "https://docs.google.com/document/d/1NAh9Om9iY-ut7Uy1CmND0V3DrSzwT8TP9bnkUuB1pQs/edit?ts=5e80f375",
	"id": 524,
	"parentId": "735",
	"dateAddedLocal": "3/30/2020, 12:18:06 PM",
	"dateAddedUTC": "2020-03-30T17:18:06.237Z"
},{
	"index": 29,
	"title": "Google Hangouts",
	"url": "https://hangouts.google.com/",
	"id": 516,
	"parentId": "735",
	"dateAddedLocal": "4/1/2020, 1:56:24 PM",
	"dateAddedUTC": "2020-04-01T18:56:24.138Z"
},{
	"index": 30,
	"title": "OB day 2 video - Google Docs",
	"url": "https://docs.google.com/document/d/1UQirYXu-ITYDRM-DAdr0S0o_SjVaa_Kr73FWwKwO6wM/edit",
	"id": 526,
	"parentId": "735",
	"dateAddedLocal": "4/1/2020, 6:48:58 PM",
	"dateAddedUTC": "2020-04-01T23:48:58.591Z"
},{
	"index": 31,
	"title": "OB Clinical Day 2: Reproductive Health Care - Clinical (2201NURS3532B100)",
	"url": "https://uth.instructure.com/courses/48949/pages/ob-clinical-day-2?module_item_id=574193",
	"id": 522,
	"parentId": "735",
	"dateAddedLocal": "4/1/2020, 6:49:31 PM",
	"dateAddedUTC": "2020-04-01T23:49:31.289Z"
},{
	"index": 32,
	"title": "ref",
	"id": 770,
	"parentId": "735",
	"dateAddedLocal": "10/8/2020, 1:47:45 PM",
	"dateAddedUTC": "2020-10-08T18:47:45.103Z"
},{
	"index": 0,
	"title": "Week 3 inspo - natepuls@gmail.com - Gmail",
	"url": "https://mail.google.com/mail/u/0/#inbox/FMfcgxwHMZSBkrBPGhlQRLLsrsqtssGW",
	"id": 719,
	"parentId": "770",
	"dateAddedLocal": "4/3/2020, 11:04:24 AM",
	"dateAddedUTC": "2020-04-03T16:04:24.262Z"
},{
	"index": 1,
	"title": "Natalie Quizlets",
	"url": "https://mail.google.com/mail/u/0/#inbox/FMfcgxwHMZSBbWrPHxVBGwxvlzFHtLjv",
	"id": 717,
	"parentId": "770",
	"dateAddedLocal": "4/3/2020, 11:17:01 AM",
	"dateAddedUTC": "2020-04-03T16:17:01.643Z"
},{
	"index": 2,
	"title": "17 attach",
	"url": "https://mail.google.com/mail/u/0/#inbox/FMfcgxwHMZSBRRFHQTVhvBCLdpMSLCJJ",
	"id": 716,
	"parentId": "770",
	"dateAddedLocal": "4/3/2020, 11:18:18 AM",
	"dateAddedUTC": "2020-04-03T16:18:18.535Z"
},{
	"index": 3,
	"title": "familiar",
	"url": "https://mail.google.com/mail/u/0/#inbox/FMfcgxwHMZSBRRDxMpTMqlpVhDnCLQzp",
	"id": 718,
	"parentId": "770",
	"dateAddedLocal": "4/3/2020, 11:18:43 AM",
	"dateAddedUTC": "2020-04-03T16:18:43.256Z"
},{
	"index": 33,
	"title": "NCLEX",
	"id": 769,
	"parentId": "735",
	"dateAddedLocal": "10/8/2020, 1:47:45 PM",
	"dateAddedUTC": "2020-10-08T18:47:45.103Z"
},{
	"index": 0,
	"title": "YBG",
	"url": "https://www.yourbestgrade.com/hesi/members_practice",
	"id": 715,
	"parentId": "769",
	"dateAddedLocal": "3/3/2020, 11:05:49 AM",
	"dateAddedUTC": "2020-03-03T17:05:49.912Z"
},{
	"index": 1,
	"title": "NCLEX practice - Google Docs",
	"url": "https://docs.google.com/document/d/1McCC7rsP2YqRHK9nIyaH3nZh67s4D_6i_Mr5tNl9YbM/edit",
	"id": 713,
	"parentId": "769",
	"dateAddedLocal": "3/5/2020, 10:23:15 AM",
	"dateAddedUTC": "2020-03-05T16:23:15.100Z"
},{
	"index": 2,
	"title": "quizlets",
	"url": "https://quizlet.com/class/4752946/",
	"id": 707,
	"parentId": "769",
	"dateAddedLocal": "3/13/2020, 5:02:44 PM",
	"dateAddedUTC": "2020-03-13T22:02:44.488Z"
},{
	"index": 3,
	"title": "module2",
	"url": "https://evolve.elsevier.com/Courses/159884_acalvin2_1001#/content/21133439639",
	"id": 706,
	"parentId": "769",
	"dateAddedLocal": "3/13/2020, 5:03:47 PM",
	"dateAddedUTC": "2020-03-13T22:03:47.666Z"
},{
	"index": 4,
	"title": "Effective non-pharmacological birth interventions. - PubMed - NCBI",
	"url": "https://www.ncbi.nlm.nih.gov/pubmed/26333246",
	"id": 705,
	"parentId": "769",
	"dateAddedLocal": "3/14/2020, 12:45:28 PM",
	"dateAddedUTC": "2020-03-14T17:45:28.213Z"
},{
	"index": 5,
	"title": "The effectiveness of breathing patterns to control maternal anxiety during the first period of labor: A randomized controlled clinical trial - ScienceDirect",
	"url": "https://www.sciencedirect.com/science/article/pii/S174438811630175X?via%3Dihub",
	"id": 704,
	"parentId": "769",
	"dateAddedLocal": "3/14/2020, 1:12:03 PM",
	"dateAddedUTC": "2020-03-14T18:12:03.869Z"
},{
	"index": 6,
	"title": "Yoga during pregnancy: The effects on labor pain and delivery outcomes (A randomized controlled trial). - PubMed - NCBI",
	"url": "https://www.ncbi.nlm.nih.gov/pubmed/28438273",
	"id": 714,
	"parentId": "769",
	"dateAddedLocal": "3/14/2020, 1:12:11 PM",
	"dateAddedUTC": "2020-03-14T18:12:11.558Z"
},{
	"index": 7,
	"title": "The effectiveness of breathing patterns to control maternal anxiety during the first period of labor: A randomized controlled clinical trial. - PubMed - NCBI",
	"url": "https://www.ncbi.nlm.nih.gov/pubmed/28107846",
	"id": 702,
	"parentId": "769",
	"dateAddedLocal": "3/14/2020, 1:12:18 PM",
	"dateAddedUTC": "2020-03-14T18:12:18.869Z"
},{
	"index": 8,
	"title": "The effect of aromatherapy with lavender essence on severity of labor pain and duration of labor in primiparous women. - PubMed - NCBI",
	"url": "https://www.ncbi.nlm.nih.gov/pubmed/27863615",
	"id": 701,
	"parentId": "769",
	"dateAddedLocal": "3/14/2020, 1:12:26 PM",
	"dateAddedUTC": "2020-03-14T18:12:26.806Z"
},{
	"index": 9,
	"title": "Complementary and alternative therapies to relieve labor pain: AÂ comparative study between music therapy and Hoku point ice massage. - PubMed - NCBI",
	"url": "https://www.ncbi.nlm.nih.gov/pubmed/26573448",
	"id": 709,
	"parentId": "769",
	"dateAddedLocal": "3/14/2020, 1:12:35 PM",
	"dateAddedUTC": "2020-03-14T18:12:35.502Z"
},{
	"index": 10,
	"title": "Effect of foot and hand massage in post-cesarean section pain control: a randomized control trial. - PubMed - NCBI",
	"url": "https://www.ncbi.nlm.nih.gov/pubmed/23352729",
	"id": 710,
	"parentId": "769",
	"dateAddedLocal": "3/14/2020, 1:12:40 PM",
	"dateAddedUTC": "2020-03-14T18:12:40.806Z"
},{
	"index": 11,
	"title": "pregnancy pain - PubMed - NCBI",
	"url": "https://www.ncbi.nlm.nih.gov/pubmed",
	"id": 703,
	"parentId": "769",
	"dateAddedLocal": "3/14/2020, 1:12:46 PM",
	"dateAddedUTC": "2020-03-14T18:12:46.413Z"
},{
	"index": 12,
	"title": "Resources â€“ TMC Library",
	"url": "https://library.tmc.edu/resources/",
	"id": 711,
	"parentId": "769",
	"dateAddedLocal": "3/14/2020, 1:12:53 PM",
	"dateAddedUTC": "2020-03-14T18:12:53.951Z"
},{
	"index": 13,
	"title": "Assignment",
	"url": "https://uth.instructure.com/courses/48912/assignments/134614",
	"id": 708,
	"parentId": "769",
	"dateAddedLocal": "3/14/2020, 12:20:50 PM",
	"dateAddedUTC": "2020-03-14T17:20:50.065Z"
},{
	"index": 14,
	"title": "HESI - iNet",
	"url": "https://www.hesiinet.com/",
	"id": 700,
	"parentId": "769",
	"dateAddedLocal": "3/25/2020, 3:54:22 PM",
	"dateAddedUTC": "2020-03-25T20:54:22.387Z"
},{
	"index": 15,
	"title": "HESI - iNet Elsevier",
	"url": "https://hesiinet.elsevier.com/",
	"id": 712,
	"parentId": "769",
	"dateAddedLocal": "3/25/2020, 3:58:31 PM",
	"dateAddedUTC": "2020-03-25T20:58:31.811Z"
},{
	"index": 47,
	"title": "Advanced Audio Player Plugin for Bubble | Plugin for Bubble by Zeroqode",
	"url": "https://zeroqode.com/plugin/advanced-audio-player-1512891032912x747531016765177900",
	"id": 1007,
	"parentId": "2",
	"dateAddedLocal": "10/22/2021, 2:44:57 PM",
	"dateAddedUTC": "2021-10-22T19:44:57.666Z"
},{
	"index": 48,
	"title": "Talon",
	"url": "https://talon.wiki/getting_started/",
	"id": 994,
	"parentId": "2",
	"dateAddedLocal": "6/5/2021, 3:45:01 PM",
	"dateAddedUTC": "2021-06-05T20:45:01.353Z"
},{
	"index": 49,
	"title": "Latest Plugins topics - Zeroqode Forum",
	"url": "https://forum.zeroqode.com/c/plugins/6",
	"id": 1009,
	"parentId": "2",
	"dateAddedLocal": "10/22/2021, 4:50:29 PM",
	"dateAddedUTC": "2021-10-22T21:50:29.636Z"
},{
	"index": 50,
	"title": "Advanced Audio Player Plugin for Bubble | Plugin for Bubble by Zeroqode",
	"url": "https://zeroqode.com/plugin/audio-player-1512891032912x747531016765177900",
	"id": 1010,
	"parentId": "2",
	"dateAddedLocal": "10/23/2021, 5:16:52 PM",
	"dateAddedUTC": "2021-10-23T22:16:52.041Z"
},{
	"index": 51,
	"title": "EKU Application Portal",
	"url": "https://application.eku.edu/apply/status?tab=welcome",
	"id": 1011,
	"parentId": "2",
	"dateAddedLocal": "10/25/2021, 9:26:34 PM",
	"dateAddedUTC": "2021-10-26T02:26:34.617Z"
},{
	"index": 52,
	"title": " talon shortcuts",
	"url": "https://talon-knausj-cheatsheet.netlify.app/",
	"id": 1012,
	"parentId": "2",
	"dateAddedLocal": "10/28/2021, 11:53:26 AM",
	"dateAddedUTC": "2021-10-28T16:53:26.945Z"
},{
	"index": 53,
	"title": "email self chrome extension - Google Search",
	"url": "https://www.google.com/search?q=email+self+chrome+extension&rlz=1C1CHBD_enUS1095US1095&oq=email+self+chrome+ex&gs_lcrp=EgZjaHJvbWUqBwgBECEYoAEyBggAEEUYOTIHCAEQIRigATIHCAIQIRigATIHCAMQIRifBdIBCDQ1MjdqMGo3qAIAsAIA&sourceid=chrome&ie=UTF-8",
	"id": 1112,
	"parentId": "2",
	"dateAddedLocal": "2/1/2024, 8:12:53 AM",
	"dateAddedUTC": "2024-02-01T14:12:53.047Z"
},{
	"index": 0,
	"title": "Moment",
	"url": "http://wyr.es/moment",
	"id": 749,
	"parentId": "3",
	"dateAddedLocal": "9/21/2020, 10:11:44 AM",
	"dateAddedUTC": "2020-09-21T15:11:44.490Z"
},{
	"index": 1,
	"title": "1 new message",
	"url": "https://wyr.es/",
	"id": 750,
	"parentId": "3",
	"dateAddedLocal": "9/23/2020, 5:30:01 PM",
	"dateAddedUTC": "2020-09-23T22:30:01.412Z"
},{
	"index": 2,
	"title": "Linktree Admin",
	"url": "https://linktr.ee/admin",
	"id": 751,
	"parentId": "3",
	"dateAddedLocal": "9/26/2020, 9:59:57 AM",
	"dateAddedUTC": "2020-09-26T14:59:57.093Z"
},{
	"index": 3,
	"title": "Home - Brand",
	"url": "https://natetest.bss.design/",
	"id": 923,
	"parentId": "3",
	"dateAddedLocal": "11/3/2020, 7:23:36 AM",
	"dateAddedUTC": "2020-11-03T13:23:36.927Z"
},{
	"index": 4,
	"title": "Nexus Virtual Suggestion Box! Survey",
	"url": "https://www.surveymonkey.com/r/NexusSuggestionBox",
	"id": 942,
	"parentId": "3",
	"dateAddedLocal": "11/17/2020, 5:33:43 AM",
	"dateAddedUTC": "2020-11-17T11:33:43.049Z"
},{
	"index": 5,
	"title": "Imperial Studio Massage & Body Works LLC - Home |â€¦",
	"url": "https://m.facebook.com/IMPERIALSTUDIOLLC/",
	"id": 956,
	"parentId": "3",
	"dateAddedLocal": "12/3/2020, 12:31:15 PM",
	"dateAddedUTC": "2020-12-03T18:31:15.959Z"
},{
	"index": 6,
	"title": "Home | Natepuls@gmail.com's Account | Cloudflare",
	"url": "https://dash.cloudflare.com/ed3b0af15e1c2b8a6a351cc929b0a312",
	"id": 1045,
	"parentId": "3",
	"dateAddedLocal": "12/9/2022, 4:31:04 PM",
	"dateAddedUTC": "2022-12-09T22:31:04.902Z"
}]